relatiivne, relatiivse, relatiivset, relatiivsesse, relatiivsete, relatiivseid
religioosne, religioosse, religioosset, religioossesse, religioossete, religioosseid
relvastatud, relvastatu, relvastatut, relvastatusse, relvastatute, relvastatuid
relvitu, relvitu, relvitut, relvitusse, relvitute, relvituid
rentaabel, rentaabli, rentaablit, rentaablisse, rentaablite, rentaableid
representaabel, representaabli, representaablit, representaablisse, representaablite, representaableid
representatiivne, representatiivse, representatiivset, representatiivsesse, representatiivsete, representatiivseid
reproduktiivne, reproduktiivse, reproduktiivset, reproduktiivsesse, reproduktiivsete, reproduktiivseid
reserveeritud, reserveeritu, reserveeritut, reserveeritusse, reserveeritute, reserveerituid
resistentne, resistentse, resistentset, resistentsesse, resistentsete, resistentseid
resoluutne, resoluutse, resoluutset, resoluutsesse, resoluutsete, resoluutseid
respektaabel, respektaabli, respektaablit, respektaablisse, respektaablite, respektaableid
restaureeriv, restaureeriva, restaureerivat, restaureerivasse, restaureerivate, restaureerivaid
resultatiivne, resultatiivse, resultatiivset, resultatiivsesse, resultatiivsete, resultatiivseid
resümeeriv, resümeeriva, resümeerivat, resümeerivasse, resümeerivate, resümeerivaid
retooriline, retoorilise, retoorilist, retoorilisesse|retoorilisse, retooriliste, retoorilisi
retseptiivne, retseptiivse, retseptiivset, retseptiivsesse, retseptiivsete, retseptiivseid
ribune, ribuse, ribust, ribusesse, ribuste, ribuseid
riiakas, riiaka, riiakat, riiakasse, riiakate, riiakaid
riietatud, riietatu, riietatut, riietatusse, riietatute, riietatuid
riiklik, riikliku, riiklikku, riiklikusse|riiklikku, riiklike|riiklikkude, riiklikke|riiklikkusid
riiukas, riiuka, riiukat, riiukasse, riiukate, riiukaid
riivatu, riivatu, riivatut, riivatusse, riivatute, riivatuid
rikas, rikka, rikast, rikkasse, rikaste, rikkaid
rikkalik, rikkaliku, rikkalikku, rikkalikusse|rikkalikku, rikkalike|rikkalikkude, rikkalikke|rikkalikkusid
rikkumatu, rikkumatu, rikkumatut, rikkumatusse, rikkumatute, rikkumatuid
riknenud, riknenu, riknenut, riknenusse, riknenute, riknenuid
rikutud, rikutu, rikutut, rikutusse, rikutute, rikutuid
rindlik, rindliku, rindlikku, rindlikusse|rindlikku, rindlike|rindlikkude, rindlikke|rindlikkusid
ringne, ringse, ringset, ringsesse, ringsete, ringseid
rinnaline, rinnalise, rinnalist, rinnalisesse|rinnalisse, rinnaliste, rinnalisi
rippumatu, rippumatu, rippumatut, rippumatusse, rippumatute, rippumatuid
riskantne, riskantse, riskantset, riskantsesse, riskantsete, riskantseid
riskeeriv, riskeeriva, riskeerivat, riskeerivasse, riskeerivate, riskeerivaid
riskiv, riskiva, riskivat, riskivasse, riskivate, riskivaid
ristine, ristise, ristist, ristisesse|ristisse, rististe, ristisi|ristiseid
ristuv, ristuva, ristuvat, ristuvasse, ristuvate, ristuvaid
risune, risuse, risust, risusesse, risuste, risuseid
riukaline, riukalise, riukalist, riukalisesse|riukalisse, riukaliste, riukalisi
riuklik, riukliku, riuklikku, riuklikusse|riuklikku, riuklike|riuklikkude, riuklikke|riuklikkusid
robustne, robustse, robustset, robustsesse, robustsete, robustseid
roheline, rohelise, rohelist, rohelisesse|rohelisse, roheliste, rohelisi
rohke, rohke, rohket, rohkesse, rohkete, rohkeid
rõhtne, rõhtsa, rõhtsat, rõhtsasse, rõhtsate, rõhtsaid
rohukas, rohuka, rohukat, rohukasse, rohukate, rohukaid
rohune, rohuse, rohust, rohusesse, rohuste, rohuseid
rõhutud, rõhutu, rõhutut, rõhutusse, rõhutute, rõhutuid
rõhuv, rõhuva, rõhuvat, rõhuvasse, rõhuvate, rõhuvaid
roid, roiu, roidu, roiusse|roidu, roidude, roide|roidusid
roidunud, roidunu, roidunut, roidunusse, roidunute, roidunuid
rõivastatud, rõivastatu, rõivastatut, rõivastatusse, rõivastatute, rõivastatuid
rõkkav, rõkkava, rõkkavat, rõkkavasse, rõkkavate, rõkkavaid
romantiline, romantilise, romantilist, romantilisesse|romantilisse, romantiliste, romantilisi
rööbik, rööbiku, rööbikut, rööbikusse, rööbikute, rööbikuid
rööbitine, rööbitise, rööbitist, rööbitisesse|rööbitisse, rööbitiste, rööbitisi
rõõmukas, rõõmuka, rõõmukat, rõõmukasse, rõõmukate, rõõmukaid
rõõmus, rõõmsa, rõõmsat, rõõmsasse, rõõmsate, rõõmsaid
rõõmustav, rõõmustava, rõõmustavat, rõõmustavasse, rõõmustavate, rõõmustavaid
rõõmutu, rõõmutu, rõõmutut, rõõmutusse, rõõmutute, rõõmutuid
rööpaline, rööpalise, rööpalist, rööpalisesse|rööpalisse, rööpaliste, rööpalisi
rööplik, rööpliku, rööplikku, rööplikusse|rööplikku, rööplike|rööplikkude, rööplikke|rööplikkusid
rööpne, rööpse, rööpset, rööpsesse, rööpsete, rööpseid
roosakas, roosaka, roosakat, roosakasse, roosakate, roosakaid
roosa, roosa, roosat, roosasse, roosade, roosasid
rõõsk, rõõsa, rõõska, rõõsasse|rõõska, rõõskade, rõõsku|rõõskasid
roostene, roostese, roostest, roostesesse|roostesse, roosteste, roostesi|roosteseid
roostetanud, roostetanu, roostetanut, roostetanusse, roostetanute, roostetanuid
röövellik, röövelliku, röövellikku, röövellikusse|röövellikku, röövellike|röövellikkude, röövellikke|röövellikkusid
ropp, ropu, roppu, ropusse|roppu, roppude, roppe|roppusid
rõske, rõske, rõsket, rõskesse, rõskete, rõskeid
rõve, rõveda, rõvedat, rõvedasse, rõvedate, rõvedaid
ruineerunu, ruineerunu, ruineerunut, ruineerunusse, ruineerunute, ruineerunuid
rumal, rumala, rumalat, rumalasse, rumalate, rumalaid
ründav, ründava, ründavat, ründavasse, ründavate, ründavaid
rünklik, rünkliku, rünklikku, rünklikusse|rünklikku, rünklike|rünklikkude, rünklikke|rünklikkusid
ruske, ruske, rusket, ruskesse, ruskete, ruskeid
rusutud, rusutu, rusutut, rusutusse, rusutute, rusutuid
rusuv, rusuva, rusuvat, rusuvasse, rusuvate, rusuvaid
rutakas, rutaka, rutakat, rutakasse, rutakate, rutakaid
rutiinne, rutiinse, rutiinset, rutiinsesse, rutiinsete, rutiinseid
rütmiline, rütmilise, rütmilist, rütmilisesse|rütmilisse, rütmiliste, rütmilisi
rutuline, rutulise, rutulist, rutulisesse|rutulisse, rutuliste, rutulisi
ruuduline, ruudulise, ruudulist, ruudulisesse|ruudulisse, ruuduliste, ruudulisi
ruuge, ruuge, ruuget, ruugesse, ruugete, ruugeid
ruumikas, ruumika, ruumikat, ruumikasse, ruumikate, ruumikaid
rüütellik, rüütelliku, rüütellikku, rüütellikusse|rüütellikku, rüütellike|rüütellikkude, rüütellikke|rüütellikkusid
saabuv, saabuva, saabuvat, saabuvasse, saabuvate, saabuvaid
saadamatu, saadamatu, saadamatut, saadamatusse, saadamatute, saadamatuid
saadav, saadava, saadavat, saadavasse, saadavate, saadavaid
saagikas, saagika, saagikat, saagikasse, saagikate, saagikaid
saagiline, saagilise, saagilist, saagilisesse|saagilisse, saagiliste, saagilisi
saagjas, saagja, saagjat, saagjasse, saagjate, saagjaid
saamatu, saamatu, saamatut, saamatusse, saamatute, saamatuid
saastatu, saastatu, saastatut, saastatusse, saastatute, saastatuid
säästlik, säästliku, säästlikku, säästlikusse|säästlikku, säästlike|säästlikkude, säästlikke|säästlikkusid
saatanlik, saatanliku, saatanlikku, saatanlikusse|saatanlikku, saatanlike|saatanlikkude, saatanlikke|saatanlikkusid
saatev, saatva, saatvat, saatvasse, saatvate, saatvaid
saatuslik, saatusliku, saatuslikku, saatuslikusse|saatuslikku, saatuslike|saatuslikkude, saatuslikke|saatuslikkusid
saav, saava, saavat, saavasse, saavate, saavaid
saavutamatu, saavutamatu, saavutamatut, saavutamatusse, saavutamatute, saavutamatuid
saavutatav, saavutatava, saavutatavat, saavutatavasse, saavutatavate, saavutatavaid
šablooniline, šabloonilise, šabloonilist, šabloonilisesse|šabloonilisse, šablooniliste, šabloonilisi
šabloonne, šabloonse, šabloonset, šabloonsesse, šabloonsete, šabloonseid
sadistlik, sadistliku, sadistlikku, sadistlikusse|sadistlikku, sadistlike|sadistlikkude, sadistlikke|sadistlikkusid
sagedane, sagedase, sagedast, sagedasesse|sagedasse, sagedaste, sagedasi
sage, sageda, sagedat, sagedasse, sagedate, sagedaid
säilinud, säilinu, säilinut, säilinusse, säilinute, säilinuid
säilitav, säilitava, säilitavat, säilitavasse, säilitavate, säilitavaid
sajune, sajuse, sajust, sajusesse, sajuste, sajuseid
sakiline, sakilise, sakilist, sakilisesse|sakilisse, sakiliste, sakilisi
sakmeline, sakmelise, sakmelist, sakmelisesse|sakmelisse, sakmeliste, sakmelisi
saksalik, saksaliku, saksalikku, saksalikusse|saksalikku, saksalike|saksalikkude, saksalikke|saksalikkusid
saksik, saksiku, saksikut, saksikusse, saksikute, saksikuid
sakslik, saksliku, sakslikku, sakslikusse|sakslikku, sakslike|sakslikkude, sakslikke|sakslikkusid
saladuslik, saladusliku, saladuslikku, saladuslikusse|saladuslikku, saladuslike|saladuslikkude, saladuslikke|saladuslikkusid
salajane, salajase, salajast, salajasesse|salajasse, salajaste, salajasi
salalik, salaliku, salalikku, salalikusse|salalikku, salalike|salalikkude, salalikke|salalikkusid
salastatud, salastatu, salastatut, salastatusse, salastatute, salastatuid
sale, saleda, saledat, saledasse, saledate, saledaid
salgav, salgava, salgavat, salgavasse, salgavate, salgavaid
sälguline, sälgulise, sälgulist, sälgulisesse|sälgulisse, sälguliste, sälgulisi
sallimatu, sallimatu, sallimatut, sallimatusse, sallimatute, sallimatuid
salliv, salliva, sallivat, sallivasse, sallivate, sallivaid
samane, samase, samast, samasesse, samaste, samaseid
sämbuline, sämbulise, sämbulist, sämbulisesse|sämbulisse, sämbuliste, sämbulisi
sämpjas, sämpja, sämpjat, sämpjasse, sämpjate, sämpjaid
sangarlik, sangarliku, sangarlikku, sangarlikusse|sangarlikku, sangarlike|sangarlikkude, sangarlikke|sangarlikkusid
sangviiniline, sangviinilise, sangviinilist, sangviinilisesse|sangviinilisse, sangviiniliste, sangviinilisi
sanitaarne, sanitaarse, sanitaarset, sanitaarsesse, sanitaarsete, sanitaarseid
santiv, santiva, santivat, santivasse, santivate, santivaid
särav, särava, säravat, säravasse, säravate, säravaid
sarkastiline, sarkastilise, sarkastilist, sarkastilisesse|sarkastilisse, sarkastiliste, sarkastilisi
šarlataanne, šarlataanse, šarlataanset, šarlataansesse, šarlataansete, šarlataanseid
šarmantne, šarmantse, šarmantset, šarmantsesse, šarmantsete, šarmantseid
sarmikas, sarmika, sarmikat, sarmikasse, sarmikate, sarmikaid
sarnane, sarnase, sarnast, sarnasesse, sarnaste, sarnaseid
sarviline, sarvilise, sarvilist, sarvilisesse|sarvilisse, sarviliste, sarvilisi
sarvitu, sarvitu, sarvitut, sarvitusse, sarvitute, sarvituid
sarvjas, sarvja, sarvjat, sarvjasse, sarvjate, sarvjaid
satiiriline, satiirilise, satiirilist, satiirilisesse|satiirilisse, satiiriliste, satiirilisi
sätitu, sätitu, sätitut, sätitusse, sätitute, sätituid
seaduslik, seadusliku, seaduslikku, seaduslikusse|seaduslikku, seaduslike|seaduslikkude, seaduslikke|seaduslikkusid
seatud, seatu, seatut, seatusse, seatute, seatuid
seeditav, seeditava, seeditavat, seeditavasse, seeditavate, seeditavaid
seedumatu, seedumatu, seedumatut, seedumatusse, seedumatute, seedumatuid
seeduv, seeduva, seeduvat, seeduvasse, seeduvate, seeduvaid
seemiline, seemilise, seemilist, seemilisesse|seemilisse, seemiliste, seemilisi
seenjas, seenja, seenjat, seenjasse, seenjate, seenjaid
seesmine, seesmise, seesmist, seesmisesse|seesmisse, seesmiste, seesmisi|seesmiseid
segane, segase, segast, segasesse, segaste, segaseid
segav, segava, segavat, segavasse, segavate, segavaid
segune, seguse, segust, segusesse, seguste, seguseid
seikluslik, seiklusliku, seikluslikku, seikluslikusse|seikluslikku, seikluslike|seikluslikkude, seikluslikke|seikluslikkusid
seisev, seisva, seisvat, seisvasse, seisvate, seisvaid
seisuline, seisulise, seisulist, seisulisesse|seisulisse, seisuliste, seisulisi
seisvusetu, seisvusetu, seisvusetut, seisvusetusse, seisvusetute, seisvusetuid
seksikas, seksika, seksikat, seksikasse, seksikate, seksikaid
seksuaalne, seksuaalse, seksuaalset, seksuaalsesse, seksuaalsete, seksuaalseid
sektantlik, sektantliku, sektantlikku, sektantlikusse|sektantlikku, sektantlike|sektantlikkude, sektantlikke|sektantlikkusid
sekundaarne, sekundaarse, sekundaarset, sekundaarsesse, sekundaarsete, sekundaarseid
selektiivne, selektiivse, selektiivset, selektiivsesse, selektiivsete, selektiivseid
seletamatu, seletamatu, seletamatut, seletamatusse, seletamatute, seletamatuid
seletav, seletava, seletavat, seletavasse, seletavate, seletavaid
selge, selge, selget, selgesse, selgete, selgeid
selgitav, selgitava, selgitavat, selgitavasse, selgitavate, selgitavaid
selgusetu, selgusetu, selgusetut, selgusetusse, selgusetute, selgusetuid
sellane, sellase, sellast, sellasesse, sellaste, sellaseid
seltsimatu, seltsimatu, seltsimatut, seltsimatusse, seltsimatute, seltsimatuid
seltsiv, seltsiva, seltsivat, seltsivasse, seltsivate, seltsivaid
seltskondlik, seltskondliku, seltskondlikku, seltskondlikusse|seltskondlikku, seltskondlike|seltskondlikkude, seltskondlikke|seltskondlikkusid
semantiline, semantilise, semantilist, semantilisesse|semantilisse, semantiliste, semantilisi
semasioloogiline, semasioloogilise, semasioloogilist, semasioloogilisesse|semasioloogilisse, semasioloogiliste, semasioloogilisi
semulik, semuliku, semulikku, semulikusse|semulikku, semulike|semulikkude, semulikke|semulikkusid
semutsev, semutseva, semutsevat, semutsevasse, semutsevate, semutsevaid
seniilne, seniilse, seniilset, seniilsesse, seniilsete, seniilseid
sensatsiooniline, sensatsioonilise, sensatsioonilist, sensatsioonilisesse|sensatsioonilisse, sensatsiooniliste, sensatsioonilisi
sensitiivne, sensitiivse, sensitiivset, sensitiivsesse, sensitiivsete, sensitiivseid
sensuaalne, sensuaalse, sensuaalset, sensuaalsesse, sensuaalsete, sensuaalseid
seosetu, seosetu, seosetut, seosetusse, seosetute, seosetuid
seostatu, seostatu, seostatut, seostatusse, seostatute, seostatuid
seotud, seotu, seotut, seotusse, seotute, seotuid
separaatne, separaatse, separaatset, separaatsesse, separaatsete, separaatseid
septiline, septilise, septilist, septilisesse|septilisse, septiliste, septilisi
servmine, servmise, servmist, servmisesse|servmisse, servmiste, servmisi|servmiseid
sesoonne, sesoonse, sesoonset, sesoonsesse, sesoonsete, sesoonseid
sibuljas, sibulja, sibuljat, sibuljasse, sibuljate, sibuljaid
sideeriline, sideerilise, sideerilist, sideerilisesse|sideerilisse, sideeriliste, sideerilisi
sidus, sidusa, sidusat, sidusasse, sidusate, sidusaid
siduv, siduva, siduvat, siduvasse, siduvate, siduvaid
sigilik, sigiliku, sigilikku, sigilikusse|sigilikku, sigilike|sigilikkude, sigilikke|sigilikkusid
sigimatu, sigimatu, sigimatut, sigimatusse, sigimatute, sigimatuid
sigiv, sigiva, sigivat, sigivasse, sigivate, sigivaid
sihilik, sihiliku, sihilikku, sihilikusse|sihilikku, sihilike|sihilikkude, sihilikke|sihilikkusid
sihiline, sihilise, sihilist, sihilisesse|sihilisse, sihiliste, sihilisi
sihitu, sihitu, sihitut, sihitusse, sihitute, sihituid
siidjas, siidja, siidjat, siidjasse, siidjate, siidjaid
siiljas, siilja, siiljat, siiljasse, siiljate, siiljaid
siiras, siira, siirast, siirasse, siiraste, siiraid
siivutu, siivutu, siivutut, siivutusse, siivutute, siivutuid
siksakiline, siksakilise, siksakilist, siksakilisesse|siksakilisse, siksakiliste, siksakilisi
sile, sileda, siledat, siledasse, siledate, siledaid
silmaline, silmalise, silmalist, silmalisesse|silmalisse, silmaliste, silmalisi
silmne, silmse, silmset, silmsesse, silmsete, silmseid
silmuseline, silmuselise, silmuselist, silmuselisesse|silmuselisse, silmuseliste, silmuselisi
silutud, silutu, silutut, silutusse, silutute, silutuid
sinakas, sinaka, sinakat, sinakasse, sinakate, sinakaid
singulaarne, singulaarse, singulaarset, singulaarsesse, singulaarsete, singulaarseid
sinine, sinise, sinist, sinisesse, siniste, siniseid
sinkjas, sinkja, sinkjat, sinkjasse, sinkjate, sinkjaid
sirge, sirge, sirget, sirgesse, sirgete, sirgeid
sisemine, sisemise, sisemist, sisemisesse|sisemisse, sisemiste, sisemisi
sisendav, sisendava, sisendavat, sisendavasse, sisendavate, sisendavaid
sisenduslik, sisendusliku, sisenduslikku, sisenduslikusse|sisenduslikku, sisenduslike|sisenduslikkude, sisenduslikke|sisenduslikkusid
sisene, sisese, sisest, sisesesse, siseste, siseseid
sisukas, sisuka, sisukat, sisukasse, sisukate, sisukaid
sisuline, sisulise, sisulist, sisulisesse|sisulisse, sisuliste, sisulisi
sisutu, sisutu, sisutut, sisutusse, sisutute, sisutuid
sitke, sitke, sitket, sitkesse, sitkete, sitkeid
siugjas, siugja, siugjat, siugjasse, siugjate, siugjaid
skemaatiline, skemaatilise, skemaatilist, skemaatilisesse|skemaatilisse, skemaatiliste, skemaatilisi
skeptiline, skeptilise, skeptilist, skeptilisesse|skeptilisse, skeptiliste, skeptilisi
skolastiline, skolastilise, skolastilist, skolastilisesse|skolastilisse, skolastiliste, skolastilisi
skoopiline, skoopilise, skoopilist, skoopilisesse|skoopilisse, skoopiliste, skoopilisi
snooblik, snoobliku, snooblikku, snooblikusse|snooblikku, snooblike|snooblikkude, snooblikke|snooblikkusid
sobilik, sobiliku, sobilikku, sobilikusse|sobilikku, sobilike|sobilikkude, sobilikke|sobilikkusid
sobimatu, sobimatu, sobimatut, sobimatusse, sobimatute, sobimatuid
sobituv, sobituva, sobituvat, sobituvasse, sobituvate, sobituvaid
sobiv, sobiva, sobivat, sobivasse, sobivate, sobivaid
sõbralik, sõbraliku, sõbralikku, sõbralikusse|sõbralikku, sõbralike|sõbralikkude, sõbralikke|sõbralikkusid
sodine, sodise, sodist, sodisesse, sodiste, sodiseid
soerdlik, soerdliku, soerdlikku, soerdlikusse|soerdlikku, soerdlike|soerdlikkude, soerdlikke|soerdlikkusid
soe, sooja, sooja, soojasse|sooja, soojade, sooje|soojasid
soetatav, soetatava, soetatavat, soetatavasse, soetatavate, soetatavaid
sofistlik, sofistliku, sofistlikku, sofistlikusse|sofistlikku, sofistlike|sofistlikkude, sofistlikke|sofistlikkusid
sogane, sogase, sogast, sogasesse, sogaste, sogaseid
sõge, sõgeda, sõgedat, sõgedasse, sõgedate, sõgedaid
soine, soise, soist, soisesse, soiste, soiseid
sõjakas, sõjaka, sõjakat, sõjakasse, sõjakate, sõjakaid
sõjaline, sõjalise, sõjalist, sõjalisesse|sõjalisse, sõjaliste, sõjalisi
šokeeritu, šokeeritu, šokeeritut, šokeeritusse, šokeeritute, šokeerituid
šokeeriv, šokeeriva, šokeerivat, šokeerivasse, šokeerivate, šokeerivaid
solgutatud, solgutatu, solgutatut, solgutatusse, solgutatute, solgutatuid
solidaarne, solidaarse, solidaarset, solidaarsesse, solidaarsete, solidaarseid
soliidne, soliidse, soliidset, soliidsesse, soliidsete, soliidseid
sõlmeline, sõlmelise, sõlmelist, sõlmelisesse|sõlmelisse, sõlmeliste, sõlmelisi
sõlmitu, sõlmitu, sõlmitut, sõlmitusse, sõlmitute, sõlmituid
sõlmjas, sõlmja, sõlmjat, sõlmjasse, sõlmjate, sõlmjaid
sõltumatu, sõltumatu, sõltumatut, sõltumatusse, sõltumatute, sõltumatuid
sõltuv, sõltuva, sõltuvat, sõltuvasse, sõltuvate, sõltuvaid
somaatiline, somaatilise, somaatilist, somaatilisesse|somaatilisse, somaatiliste, somaatilisi
sombuline, sombulise, sombulist, sombulisesse|sombulisse, sombuliste, sombulisi
sõmerdatu, sõmerdatu, sõmerdatut, sõmerdatusse, sõmerdatute, sõmerdatuid
sõmerjas, sõmerja, sõmerjat, sõmerjasse, sõmerjate, sõmerjaid
sõmer, sõmera, sõmerat, sõmerasse, sõmerate, sõmeraid
sõnaline, sõnalise, sõnalist, sõnalisesse|sõnalisse, sõnaliste, sõnalisi
sõnastuslik, sõnastusliku, sõnastuslikku, sõnastuslikusse|sõnastuslikku, sõnastuslike|sõnastuslikkude, sõnastuslikke|sõnastuslikkusid
sööbiv, sööbiva, sööbivat, sööbivasse, sööbivate, sööbivaid
söödav, söödava, söödavat, söödavasse, söödavate, söödavaid
soodne, soodsa, soodsat, soodsasse, soodsate, soodsaid
söödud, söödu, söödut, söödusse, söödute, sööduid
soodus, soodsa, soodsat, soodsasse, soodsate, soodsaid
sööjalik, sööjaliku, sööjalikku, sööjalikusse|sööjalikku, sööjalike|sööjalikkude, sööjalikke|sööjalikkusid
soojane, soojase, soojast, soojasesse, soojaste, soojaseid
soojuslik, soojusliku, soojuslikku, soojuslikusse|soojuslikku, soojuslike|soojuslikkude, soojuslikke|soojuslikkusid
soolane, soolase, soolast, soolasesse, soolaste, soolaseid
sooline, soolise, soolist, soolisesse|soolisse, sooliste, soolisi|sooliseid
sooneline, soonelise, soonelist, soonelisesse|soonelisse, sooneliste, soonelisi
soonikas, soonika, soonikat, soonikasse, soonikate, soonikaid
sooniline, soonilise, soonilist, soonilisesse|soonilisse, sooniliste, soonilisi
soonine, soonise, soonist, soonisesse, sooniste, sooniseid
söönud, söönu, söönut, söönusse, söönute, söönuid
sõõrjas, sõõrja, sõõrjat, sõõrjasse, sõõrjate, sõõrjaid
soositu, soositu, soositut, soositusse, soositute, soosituid
sootu, sootu, sootut, sootusse, sootute, sootuid
soovimatu, soovimatu, soovimatut, soovimatusse, soovimatute, soovimatuid
soovitav, soovitava, soovitavat, soovitavasse, soovitavate, soovitavaid
soovitud, soovitu, soovitut, soovitusse, soovitute, soovituid
sooviv, sooviva, soovivat, soovivasse, soovivate, soovivaid
soovlik, soovliku, soovlikku, soovlikusse|soovlikku, soovlike|soovlikkude, soovlikke|soovlikkusid
sorav, sorava, soravat, soravasse, soravate, soravaid
sotsiaalne, sotsiaalse, sotsiaalset, sotsiaalsesse, sotsiaalsete, sotsiaalseid
sotsialistlik, sotsialistliku, sotsialistlikku, sotsialistlikusse|sotsialistlikku, sotsialistlike|sotsialistlikkude, sotsialistlikke|sotsialistlikkusid
spasmiline, spasmilise, spasmilist, spasmilisesse|spasmilisse, spasmiliste, spasmilisi
spektiivne, spektiivse, spektiivset, spektiivsesse, spektiivsete, spektiivseid
spetsiaalne, spetsiaalse, spetsiaalset, spetsiaalsesse, spetsiaalsete, spetsiaalseid
spetsiifiline, spetsiifilise, spetsiifilist, spetsiifilisesse|spetsiifilisse, spetsiifiliste, spetsiifilisi
spiraalne, spiraalse, spiraalset, spiraalsesse, spiraalsete, spiraalseid
spirituaalne, spirituaalse, spirituaalset, spirituaalsesse, spirituaalsete, spirituaalseid
spontaanne, spontaanse, spontaanset, spontaansesse, spontaansete, spontaanseid
sporaadiline, sporaadilise, sporaadilist, sporaadilisesse|sporaadilisse, sporaadiliste, sporaadilisi
sportlik, sportliku, sportlikku, sportlikusse|sportlikku, sportlike|sportlikkude, sportlikke|sportlikkusid
staatiline, staatilise, staatilist, staatilisesse|staatilisse, staatiliste, staatilisi
staažikas, staažika, staažikat, staažikasse, staažikate, staažikaid
stabiilne, stabiilse, stabiilset, stabiilsesse, stabiilsete, stabiilseid
stagneerunu, stagneerunu, stagneerunut, stagneerunusse, stagneerunute, stagneerunuid
standardne, standardse, standardset, standardsesse, standardsete, standardseid
statistiline, statistilise, statistilist, statistilisesse|statistilisse, statistiliste, statistilisi
statsionaarne, statsionaarse, statsionaarset, statsionaarsesse, statsionaarsete, statsionaarseid
stellaarne, stellaarse, stellaarset, stellaarsesse, stellaarsete, stellaarseid
steriilne, steriilse, steriilset, steriilsesse, steriilsete, steriilseid
stiihiline, stiihilise, stiihilist, stiihilisesse|stiihilisse, stiihiliste, stiihilisi
stiilitu, stiilitu, stiilitut, stiilitusse, stiilitute, stiilituid
stiilne, stiilse, stiilset, stiilsesse, stiilsete, stiilseid
stimuleeritu, stimuleeritu, stimuleeritut, stimuleeritusse, stimuleeritute, stimuleerituid
stohhastiline, stohhastilise, stohhastilist, stohhastilisesse|stohhastilisse, stohhastiliste, stohhastilisi
stoiline, stoilise, stoilist, stoilisesse|stoilisse, stoiliste, stoilisi|stoiliseid
struktureeritu, struktureeritu, struktureeritut, struktureeritusse, struktureeritute, struktureerituid
subjektiivne, subjektiivse, subjektiivset, subjektiivsesse, subjektiivsete, subjektiivseid
subliimne, subliimse, subliimset, subliimsesse, subliimsete, subliimseid
südajas, südaja, südajat, südajasse, südajate, südajaid
südametu, südametu, südametut, südametusse, südametute, südametuid
südamlik, südamliku, südamlikku, südamlikusse|südamlikku, südamlike|südamlikkude, südamlikke|südamlikkusid
sügav, sügava, sügavat, sügavasse, sügavate, sügavaid
sugestiivne, sugestiivse, sugestiivset, sugestiivsesse, sugestiivsete, sugestiivseid
sügisene, sügisese, sügisest, sügisesesse|sügisesse, sügiseste, sügisesi
suguline, sugulise, sugulist, sugulisesse|sugulisse, suguliste, sugulisi
sugune, suguse, sugust, sugusesse, suguste, suguseid
sugutu, sugutu, sugutut, sugutusse, sugutute, sugutuid
suhteline, suhtelise, suhtelist, suhtelisesse|suhtelisse, suhteliste, suhtelisi
suhtlev, suhtleva, suhtlevat, suhtlevasse, suhtlevate, suhtlevaid
suitsjas, suitsja, suitsjat, suitsjasse, suitsjate, suitsjaid
suitsune, suitsuse, suitsust, suitsusesse, suitsuste, suitsuseid
sujuv, sujuva, sujuvat, sujuvasse, sujuvate, sujuvaid
sulanu, sulanu, sulanut, sulanusse, sulanute, sulanuid
sula, sula, sula, sulasse, sulade, sulasid
suletud, suletu, suletut, suletusse, suletute, suletuid
sulgne, sulgse, sulgset, sulgsesse, sulgsete, sulgseid
sulgunu, sulgunu, sulgunut, sulgunusse, sulgunute, sulgunuid
suline, sulise, sulist, sulisesse, suliste, suliseid
sulnis, sulni, sulnist, sulnisse, sulniste, sulneid
sültjas, sültja, sültjat, sültjasse, sültjate, sültjaid
sumbe, sumbe, sumbet, sumbesse, sumbete, sumbeid
sume, sumeda, sumedat, sumedasse, sumedate, sumedaid
sümmeetriline, sümmeetrilise, sümmeetrilist, sümmeetrilisesse|sümmeetrilisse, sümmeetriliste, sümmeetrilisi
sümpaatne, sümpaatse, sümpaatset, sümpaatsesse, sümpaatsete, sümpaatseid
sundimatu, sundimatu, sundimatut, sundimatusse, sundimatute, sundimatuid
sündinud, sündinu, sündinut, sündinusse, sündinute, sündinuid
sundiv, sundiva, sundivat, sundivasse, sundivate, sundivaid
sündmatu, sündmatu, sündmatut, sündmatusse, sündmatute, sündmatuid
sündsusetu, sündsusetu, sündsusetut, sündsusetusse, sündsusetute, sündsusetuid
sunduslik, sundusliku, sunduslikku, sunduslikusse|sunduslikku, sunduslike|sunduslikkude, sunduslikke|sunduslikkusid
sünge, sünge, sünget, süngesse, süngete, süngeid
sünkjas, sünkja, sünkjat, sünkjasse, sünkjate, sünkjaid
