ladus, ladusa, ladusat, ladusasse, ladusate, ladusaid
laetud, laetu, laetut, laetusse, laetute, laetuid
lage, lageda, lagedat, lagedasse, lagedate, lagedaid
lagunenud, lagunenu, lagunenut, lagunenusse, lagunenute, lagunenuid
lähedane, lähedase, lähedast, lähedasesse|lähedasse, lähedaste, lähedasi
lahe, laheda, lahedat, lahedasse, lahedate, lahedaid
lähenev, läheneva, lähenevat, lähenevasse, lähenevate, lähenevaid
lahja, lahja, lahjat, lahjasse, lahjade, lahjasid
lahke, lahke, lahket, lahkesse, lahkete, lahkeid
lahkusetu, lahkusetu, lahkusetut, lahkusetusse, lahkusetute, lahkusetuid
lahtine, lahtise, lahtist, lahtisesse|lahtisse, lahtiste, lahtisi|lahtiseid
lahutamatu, lahutamatu, lahutamatut, lahutamatusse, lahutamatute, lahutamatuid
lahutatud, lahutatu, lahutatut, lahutatusse, lahutatute, lahutatuid
lahutuslik, lahutusliku, lahutuslikku, lahutuslikusse|lahutuslikku, lahutuslike|lahutuslikkude, lahutuslikke|lahutuslikkusid
laialdane, laialdase, laialdast, laialdasesse|laialdasse, laialdaste, laialdasi
laiguline, laigulise, laigulist, laigulisesse|laigulisse, laiguliste, laigulisi
läiketu, läiketu, läiketut, läiketusse, läiketute, läiketuid
läikiv, läikiva, läikivat, läikivasse, läikivate, läikivaid
lai, laia, laia, laiasse|laia, laiade, laiu|laiasid
läila, läila, läilat, läilasse, läilade, läilasid
laineline, lainelise, lainelist, lainelisesse|lainelisse, laineliste, lainelisi
lainjas, lainja, lainjat, lainjasse, lainjate, lainjaid
läinud, läinu, läinut, läinusse, läinute, läinuid
laisk, laisa, laiska, laisasse|laiska, laiskade, laisku|laiskasid
laitmatu, laitmatu, laitmatut, laitmatusse, laitmatute, laitmatuid
lakkamatu, lakkamatu, lakkamatut, lakkamatusse, lakkamatute, lakkamatuid
lakooniline, lakoonilise, lakoonilist, lakoonilisesse|lakoonilisse, lakooniliste, lakoonilisi
lame, lameda, lamedat, lamedasse, lamedate, lamedaid
lammutav, lammutava, lammutavat, lammutavasse, lammutavate, lammutavaid
laostunu, laostunu, laostunut, laostunusse, laostunute, laostunuid
läpane, läpase, läpast, läpasesse, läpaste, läpaseid
lapergune, laperguse, lapergust, lapergusesse|lapergusse, laperguste, lapergusi
laperik, laperiku, laperikku, laperikusse|laperikku, laperike|laperikkude, laperikke|laperikkusid
lapidaarne, lapidaarse, lapidaarset, lapidaarsesse, lapidaarsete, lapidaarseid
lapik, lapiku, lapikut, lapikusse, lapikute, lapikuid
lapiline, lapilise, lapilist, lapilisesse|lapilisse, lapiliste, lapilisi
läppunu, läppunu, läppunut, läppunusse, läppunute, läppunuid
lapselik, lapseliku, lapselikku, lapselikusse|lapselikku, lapselike|lapselikkude, lapselikke|lapselikkusid
lapsik, lapsiku, lapsikut, lapsikusse, lapsikute, lapsikuid
lapsine, lapsise, lapsist, lapsisesse, lapsiste, lapsiseid
laristav, laristava, laristavat, laristavasse, laristavate, laristavaid
lärmakas, lärmaka, lärmakat, lärmakasse, lärmakate, lärmakaid
lärmav, lärmava, lärmavat, lärmavasse, lärmavate, lärmavaid
lärmikas, lärmika, lärmikat, lärmikasse, lärmikate, lärmikaid
latentne, latentse, latentset, latentsesse, latentsete, latentseid
lauge, lauge, lauget, laugesse, laugete, laugeid
laugjas, laugja, laugjat, laugjasse, laugjate, laugjaid
laululine, laululise, laululist, laululisesse|laululisse, laululiste, laululisi
lausaline, lausalise, lausalist, lausalisesse|lausalisse, lausaliste, lausalisi
lausik, lausiku, lausikut, lausikusse, lausikute, lausikuid
lauskjas, lauskja, lauskjat, lauskjasse, lauskjate, lauskjaid
lausk, lausa, lauska, lausasse|lauska, lauskade, lausku|lauskasid
laveeriv, laveeriva, laveerivat, laveerivasse, laveerivate, laveerivaid
leebe, leebe, leebet, leebesse, leebete, leebeid
leegitsev, leegitseva, leegitsevat, leegitsevasse, leegitsevate, leegitsevaid
leeliseline, leeliselise, leeliselist, leeliselisesse|leeliselisse, leeliseliste, leeliselisi
leelisene, leelisese, leelisest, leelisesesse|leelisesse, leeliseste, leelisesi
leemendav, leemendava, leemendavat, leemendavasse, leemendavate, leemendavaid
legaalne, legaalse, legaalset, legaalsesse, legaalsete, legaalseid
legendaarne, legendaarse, legendaarset, legendaarsesse, legendaarsete, legendaarseid
legitiimne, legitiimse, legitiimset, legitiimsesse, legitiimsete, legitiimseid
lehine, lehise, lehist, lehisesse, lehiste, lehiseid
lehkav, lehkava, lehkavat, lehkavasse, lehkavate, lehkavaid
leidlik, leidliku, leidlikku, leidlikusse|leidlikku, leidlike|leidlikkude, leidlikke|leidlikkusid
leierdatu, leierdatu, leierdatut, leierdatusse, leierdatute, leierdatuid
leige, leige, leiget, leigesse, leigete, leigeid
leinaline, leinalise, leinalist, leinalisesse|leinalisse, leinaliste, leinalisi
leinav, leinava, leinavat, leinavasse, leinavate, leinavaid
lekkiv, lekkiva, lekkivat, lekkivasse, lekkivate, lekkivaid
lembeline, lembelise, lembelist, lembelisesse|lembelisse, lembeliste, lembelisi
lembene, lembese, lembest, lembesesse|lembesse, lembeste, lembesi|lembeseid
lemmeline, lemmelise, lemmelist, lemmelisesse|lemmelisse, lemmeliste, lemmelisi
lennukas, lennuka, lennukat, lennukasse, lennukate, lennukaid
lennuline, lennulise, lennulist, lennulisesse|lennulisse, lennuliste, lennulisi
leplik, lepliku, leplikku, leplikusse|leplikku, leplike|leplikkude, leplikke|leplikkusid
leppeline, leppelise, leppelist, leppelisesse|leppelisse, leppeliste, leppelisi
leppimatu, leppimatu, leppimatut, leppimatusse, leppimatute, leppimatuid
leppiv, leppiva, leppivat, leppivasse, leppivate, leppivaid
letaalne, letaalse, letaalset, letaalsesse, letaalsete, letaalseid
levinud, levinu, levinut, levinusse, levinute, levinuid
libe, libeda, libedat, libedasse, libedate, libedaid
liberaalne, liberaalse, liberaalset, liberaalsesse, liberaalsete, liberaalseid
ligane, ligase, ligast, ligasesse, ligaste, ligaseid
lige, ligeda, ligedat, ligedasse, ligedate, ligedaid
ligidane, ligidase, ligidast, ligidasesse|ligidasse, ligidaste, ligidasi
ligunenu, ligunenu, ligunenut, ligunenusse, ligunenute, ligunenuid
lihalik, lihaliku, lihalikku, lihalikusse|lihalikku, lihalike|lihalikkude, lihalikke|lihalikkusid
lihane, lihase, lihast, lihasesse, lihaste, lihaseid
lihaseline, lihaselise, lihaselist, lihaselisesse|lihaselisse, lihaseliste, lihaselisi
lihav, lihava, lihavat, lihavasse, lihavate, lihavaid
lihtne, lihtsa, lihtsat, lihtsasse, lihtsate, lihtsaid
lihvitud, lihvitu, lihvitut, lihvitusse, lihvitute, lihvituid
lihviv, lihviva, lihvivat, lihvivasse, lihvivate, lihvivaid
liialdamatu, liialdamatu, liialdamatut, liialdamatusse, liialdamatute, liialdamatuid
liialdane, liialdase, liialdast, liialdasesse|liialdasse, liialdaste, liialdasi
liialdatud, liialdatu, liialdatut, liialdatusse, liialdatute, liialdatuid
liialdav, liialdava, liialdavat, liialdavasse, liialdavate, liialdavaid
liialduslik, liialdusliku, liialduslikku, liialduslikusse|liialduslikku, liialduslike|liialduslikkude, liialduslikke|liialduslikkusid
liialine, liialise, liialist, liialisesse|liialisse, liialiste, liialisi
liiane, liiase, liiast, liiasesse, liiaste, liiaseid
liiderlik, liiderliku, liiderlikku, liiderlikusse|liiderlikku, liiderlike|liiderlikkude, liiderlikke|liiderlikkusid
liidetu, liidetu, liidetut, liidetusse, liidetute, liidetuid
liigne, liigse, liigset, liigsesse, liigsete, liigseid
liigutav, liigutava, liigutavat, liigutavasse, liigutavate, liigutavaid
liikumatu, liikumatu, liikumatut, liikumatusse, liikumatute, liikumatuid
liikuv, liikuva, liikuvat, liikuvasse, liikuvate, liikuvaid
liipav, liipava, liipavat, liipavasse, liipavate, liipavaid
liitne, liitse, liitset, liitsesse, liitsete, liitseid
likviidne, likviidse, likviidset, likviidsesse, likviidsete, likviidseid
lillakas, lillaka, lillakat, lillakasse, lillakate, lillakaid
lilla, lilla, lillat, lillasse, lillade, lillasid
lilleline, lillelise, lillelist, lillelisesse|lillelisse, lilleliste, lillelisi
limiteeritu, limiteeritu, limiteeritut, limiteeritusse, limiteeritute, limiteerituid
lineaarne, lineaarse, lineaarset, lineaarsesse, lineaarsete, lineaarseid
lingviline, lingvilise, lingvilist, lingvilisesse|lingvilisse, lingviliste, lingvilisi
linlik, linliku, linlikku, linlikusse|linlikku, linlike|linlikkude, linlikke|linlikkusid
linnalik, linnaliku, linnalikku, linnalikusse|linnalikku, linnalike|linnalikkude, linnalikke|linnalikkusid
linnaline, linnalise, linnalist, linnalisesse|linnalisse, linnaliste, linnalisi
lipitsev, lipitseva, lipitsevat, lipitsevasse, lipitsevate, lipitsevaid
literaarne, literaarse, literaarset, literaarsesse, literaarsete, literaarseid
literatuurne, literatuurse, literatuurset, literatuursesse, literatuursete, literatuurseid
lobisev, lobiseva, lobisevat, lobisevasse, lobisevate, lobisevaid
lobjakane, lobjakase, lobjakast, lobjakasesse|lobjakasse, lobjakaste, lobjakasi
lõbus, lõbusa, lõbusat, lõbusasse, lõbusate, lõbusaid
lõbutu, lõbutu, lõbutut, lõbutusse, lõbutute, lõbutuid
lodev, lodeva, lodevat, lodevasse, lodevate, lodevaid
lödine, lödise, lödist, lödisesse, lödiste, lödiseid
lõdvestunu, lõdvestunu, lõdvestunut, lõdvestunusse, lõdvestunute, lõdvestunuid
loetav, loetava, loetavat, loetavasse, loetavate, loetavaid
loetlematu, loetlematu, loetlematut, loetlematusse, loetlematute, loetlematuid
lögane, lögase, lögast, lögasesse, lögaste, lögaseid
logisev, logiseva, logisevat, logisevasse, logisevate, logisevaid
logu, logu, logu, logusse, logude, logusid
lohakas, lohaka, lohakat, lohakasse, lohakate, lohakaid
lõheline, lõhelise, lõhelist, lõhelisesse|lõhelisse, lõheliste, lõhelisi
lõhkine, lõhkise, lõhkist, lõhkisesse|lõhkisse, lõhkiste, lõhkisi|lõhkiseid
lõhnaline, lõhnalise, lõhnalist, lõhnalisesse|lõhnalisse, lõhnaliste, lõhnalisi
lõhnav, lõhnava, lõhnavat, lõhnavasse, lõhnavate, lõhnavaid
lohutamatu, lohutamatu, lohutamatut, lohutamatusse, lohutamatute, lohutamatuid
lohutu, lohutu, lohutut, lohutusse, lohutute, lohutuid
loid, loiu, loidu, loiusse|loidu, loidude, loide|loidusid
lõikav, lõikava, lõikavat, lõikavasse, lõikavate, lõikavaid
lojaalne, lojaalse, lojaalset, lojaalsesse, lojaalsete, lojaalseid
lokaalne, lokaalse, lokaalset, lokaalsesse, lokaalsete, lokaalseid
loll, lolli, lolli, lollisse|lolli, lollide, lolle|lollisid
lombakas, lombaka, lombakat, lombakasse, lombakate, lombakaid
lombak, lombaku, lombakut, lombakusse, lombakute, lombakuid
lömitav, lömitava, lömitavat, lömitavasse, lömitavate, lömitavaid
lonkav, lonkava, lonkavat, lonkavasse, lonkavate, lonkavaid
loodne, loodse, loodset, loodsesse, loodsete, loodseid
löödud, löödu, löödut, löödusse, löödute, lööduid
looduslik, loodusliku, looduslikku, looduslikusse|looduslikku, looduslike|looduslikkude, looduslikke|looduslikkusid
lõõgastunu, lõõgastunu, lõõgastunut, lõõgastunusse, lõõgastunute, lõõgastunuid
loogeline, loogelise, loogelist, loogelisesse|loogelisse, loogeliste, loogelisi
loogiline, loogilise, loogilist, loogilisesse|loogilisse, loogiliste, loogilisi
lookeline, lookelise, lookelist, lookelisesse|lookelisse, lookeliste, lookelisi
looklev, lookleva, looklevat, looklevasse, looklevate, looklevaid
loomalik, loomaliku, loomalikku, loomalikusse|loomalikku, loomalike|loomalikkude, loomalikke|loomalikkusid
lõõmav, lõõmava, lõõmavat, lõõmavasse, lõõmavate, lõõmavaid
loominguline, loomingulise, loomingulist, loomingulisesse|loomingulisse, loominguliste, loomingulisi
loomne, loomse, loomset, loomsesse, loomsete, loomseid
loomulik, loomuliku, loomulikku, loomulikusse|loomulikku, loomulike|loomulikkude, loomulikke|loomulikkusid
loomuline, loomulise, loomulist, loomulisesse|loomulisse, loomuliste, loomulisi
loomustav, loomustava, loomustavat, loomustavasse, loomustavate, loomustavaid
lootusetu, lootusetu, lootusetut, lootusetusse, lootusetute, lootusetuid
lootuslik, lootusliku, lootuslikku, lootuslikusse|lootuslikku, lootuslike|lootuslikkude, lootuslikke|lootuslikkusid
loov, loova, loovat, loovasse, loovate, loovaid
lopane, lopase, lopast, lopasesse, lopaste, lopaseid
lopergune, loperguse, lopergust, lopergusesse|lopergusse, loperguste, lopergusi
lõpetatud, lõpetatu, lõpetatut, lõpetatusse, lõpetatute, lõpetatuid
lõpetav, lõpetava, lõpetavat, lõpetavasse, lõpetavate, lõpetavaid
lõplik, lõpliku, lõplikku, lõplikusse|lõplikku, lõplike|lõplikkude, lõplikke|lõplikkusid
lõppematu, lõppematu, lõppematut, lõppematusse, lõppematute, lõppematuid
lõppenud, lõppenu, lõppenut, lõppenusse, lõppenute, lõppenuid
lopsakas, lopsaka, lopsakat, lopsakasse, lopsakate, lopsakaid
lõputu, lõputu, lõputut, lõputusse, lõputute, lõputuid
lörtsine, lörtsise, lörtsist, lörtsisesse, lörtsiste, lörtsiseid
loslik, losliku, loslikku, loslikusse|loslikku, loslike|loslikkude, loslikke|loslikkusid
lõtv, lõdva, lõtva, lõdvasse|lõtva, lõtvade, lõtvu|lõtvasid
lõunane, lõunase, lõunast, lõunasesse|lõunasse, lõunaste, lõunasi|lõunaseid
lubamatu, lubamatu, lubamatut, lubamatusse, lubamatute, lubamatuid
lubatav, lubatava, lubatavat, lubatavasse, lubatavate, lubatavaid
lubatud, lubatu, lubatut, lubatusse, lubatute, lubatuid
lubav, lubava, lubavat, lubavasse, lubavate, lubavaid
lüheldane, lüheldase, lüheldast, lüheldasesse|lüheldasse, lüheldaste, lüheldasi
lühendatu, lühendatu, lühendatut, lühendatusse, lühendatute, lühendatuid
lühike, lühikese, lühikest, lühikesesse|lühikesse, lühikeste, lühikesi
luhtunud, luhtunu, luhtunut, luhtunusse, luhtunute, luhtunuid
luine, luise, luist, luisesse, luiste, luiseid
lükkamatu, lükkamatu, lükkamatut, lükkamatusse, lükkamatute, lükkamatuid
luksuslik, luksusliku, luksuslikku, luksuslikusse|luksuslikku, luksuslike|luksuslikkude, luksuslikke|luksuslikkusid
lumine, lumise, lumist, lumisesse, lumiste, lumiseid
lummav, lummava, lummavat, lummavasse, lummavate, lummavaid
lummutuslik, lummutusliku, lummutuslikku, lummutuslikusse|lummutuslikku, lummutuslike|lummutuslikkude, lummutuslikke|lummutuslikkusid
lünklik, lünkliku, lünklikku, lünklikusse|lünklikku, lünklike|lünklikkude, lünklikke|lünklikkusid
lustakas, lustaka, lustakat, lustakasse, lustakate, lustakaid
lustiline, lustilise, lustilist, lustilisesse|lustilisse, lustiliste, lustilisi
lustlik, lustliku, lustlikku, lustlikusse|lustlikku, lustlike|lustlikkude, lustlikke|lustlikkusid
luulelik, luuleliku, luulelikku, luulelikusse|luulelikku, luulelike|luulelikkude, luulelikke|luulelikkusid
luuleline, luulelise, luulelist, luulelisesse|luulelisse, luuleliste, luulelisi
lüüriline, lüürilise, lüürilist, lüürilisesse|lüürilisse, lüüriliste, lüürilisi
maagiline, maagilise, maagilist, maagilisesse|maagilisse, maagiliste, maagilisi
maakondlik, maakondliku, maakondlikku, maakondlikusse|maakondlikku, maakondlike|maakondlikkude, maakondlikke|maakondlikkusid
maalik, maaliku, maalikku, maalikusse|maalikku, maalike|maalikkude, maalikke|maalikkusid
maaliline, maalilise, maalilist, maalilisesse|maalilisse, maaliliste, maalilisi
maaline, maalise, maalist, maalisesse|maalisse, maaliste, maalisi|maaliseid
maaliv, maaliva, maalivat, maalivasse, maalivate, maalivaid
määraline, määralise, määralist, määralisesse|määralisse, määraliste, määralisi
määramatu, määramatu, määramatut, määramatusse, määramatute, määramatuid
määrane, määrase, määrast, määrasesse, määraste, määraseid
määratlematu, määratlematu, määratlematut, määratlematusse, määratlematute, määratlematuid
määratud, määratu, määratut, määratusse, määratute, määratuid
määratu, määratu, määratut, määratusse, määratute, määratuid
määrav, määrava, määravat, määravasse, määravate, määravaid
määrdunud, määrdunu, määrdunut, määrdunusse, määrdunute, määrdunuid
madaldav, madaldava, madaldavat, madaldavasse, madaldavate, madaldavaid
madal, madala, madalat, madalasse, madalate, madalaid
mäda, mäda, mäda, mädasse, mädade, mädasid
mädanenud, mädanenu, mädanenut, mädanenusse, mädanenute, mädanenuid
magav, magava, magavat, magavasse, magavate, magavaid
mage, mageda, magedat, magedasse, magedate, magedaid
magnetiline, magnetilise, magnetilist, magnetilisesse|magnetilisse, magnetiliste, magnetilisi
magus, magusa, magusat, magusasse, magusate, magusaid
mahe, maheda, mahedat, mahedasse, mahedate, mahedaid
mahendav, mahendava, mahendavat, mahendavasse, mahendavate, mahendavaid
mahlakas, mahlaka, mahlakat, mahlakasse, mahlakate, mahlakaid
mahlane, mahlase, mahlast, mahlasesse, mahlaste, mahlaseid
mahlatu, mahlatu, mahlatut, mahlatusse, mahlatute, mahlatuid
mahukas, mahuka, mahukat, mahukasse, mahukate, mahukaid
maias, maia, maiast, maiasse, maiaste, maiaid
maiguline, maigulise, maigulist, maigulisesse|maigulisse, maiguliste, maigulisi
maine, maise, maist, maisesse, maiste, maiseid
maitsekas, maitseka, maitsekat, maitsekasse, maitsekate, maitsekaid
maitseline, maitselise, maitselist, maitselisesse|maitselisse, maitseliste, maitselisi
maitsetu, maitsetu, maitsetut, maitsetusse, maitsetute, maitsetuid
maitsev, maitsva, maitsvat, maitsvasse, maitsvate, maitsvaid
majanduslik, majandusliku, majanduslikku, majanduslikusse|majanduslikku, majanduslike|majanduslikkude, majanduslikke|majanduslikkusid
majesteetlik, majesteetliku, majesteetlikku, majesteetlikusse|majesteetlikku, majesteetlike|majesteetlikkude, majesteetlikke|majesteetlikkusid
maksev, maksva, maksvat, maksvasse, maksvate, maksvaid
maksimaalne, maksimaalse, maksimaalset, maksimaalsesse, maksimaalsete, maksimaalseid
makstav, makstava, makstavat, makstavasse, makstavate, makstavaid
maksuline, maksulise, maksulist, maksulisesse|maksulisse, maksuliste, maksulisi
maksvusetu, maksvusetu, maksvusetut, maksvusetusse, maksvusetute, maksvusetuid
malbe, malbe, malbet, malbesse, malbete, malbeid
maldamatu, maldamatu, maldamatut, maldamatusse, maldamatute, maldamatuid
mandriline, mandrilise, mandrilist, mandrilisesse|mandrilisse, mandriliste, mandrilisi
maneerlik, maneerliku, maneerlikku, maneerlikusse|maneerlikku, maneerlike|maneerlikkude, maneerlikke|maneerlikkusid
manguv, manguva, manguvat, manguvasse, manguvate, manguvaid
manipuleeriv, manipuleeriva, manipuleerivat, manipuleerivasse, manipuleerivate, manipuleerivaid
mannetu, mannetu, mannetut, mannetusse, mannetute, mannetuid
manuaalne, manuaalse, manuaalset, manuaalsesse, manuaalsete, manuaalseid
maokas, maoka, maokat, maokasse, maokate, maokaid
maotu, maotu, maotut, maotusse, maotute, maotuid
märgatamatu, märgatamatu, märgatamatut, märgatamatusse, märgatamatute, märgatamatuid
märgatav, märgatava, märgatavat, märgatavasse, märgatavate, märgatavaid
marginaalne, marginaalse, marginaalset, marginaalsesse, marginaalsete, marginaalseid
märg, märja, märga, märjasse|märga, märgade, märgi|märgasid
mariinne, mariinse, mariinset, mariinsesse, mariinsete, mariinseid
maritiimne, maritiimse, maritiimset, maritiimsesse, maritiimsete, maritiimseid
märkamatu, märkamatu, märkamatut, märkamatusse, märkamatute, märkamatuid
markantne, markantse, markantset, markantsesse, markantsete, markantseid
marksistlik, marksistliku, marksistlikku, marksistlikusse|marksistlikku, marksistlike|marksistlikkude, marksistlikke|marksistlikkusid
maruline, marulise, marulist, marulisesse|marulisse, maruliste, marulisi
marune, maruse, marust, marusesse, maruste, maruseid
masendatud, masendatu, masendatut, masendatusse, masendatute, masendatuid
masendunu, masendunu, masendunut, masendunusse, masendunute, masendunuid
masinlik, masinliku, masinlikku, masinlikusse|masinlikku, masinlike|masinlikkude, masinlikke|masinlikkusid
maskuliinne, maskuliinse, maskuliinset, maskuliinsesse, maskuliinsete, maskuliinseid
mäslev, mäsleva, mäslevat, mäslevasse, mäslevate, mäslevaid
massiivne, massiivse, massiivset, massiivsesse, massiivsete, massiivseid
massiline, massilise, massilist, massilisesse|massilisse, massiliste, massilisi
mastaapne, mastaapse, mastaapset, mastaapsesse, mastaapsete, mastaapseid
matemaatiline, matemaatilise, matemaatilist, matemaatilisesse|matemaatilisse, matemaatiliste, matemaatilisi
materiaalne, materiaalse, materiaalset, materiaalsesse, materiaalsete, materiaalseid
mätlik, mätliku, mätlikku, mätlikusse|mätlikku, mätlike|mätlikkude, mätlikke|mätlikkusid
matriarhaalne, matriarhaalse, matriarhaalset, matriarhaalsesse, matriarhaalsete, matriarhaalseid
matsakas, matsaka, matsakat, matsakasse, matsakate, matsakaid
matslik, matsliku, matslikku, matslikusse|matslikku, matslike|matslikkude, matslikke|matslikkusid
mättaline, mättalise, mättalist, mättalisesse|mättalisse, mättaliste, mättalisi
matt, mati, matti, matisse|matti, mattide, matte|mattisid
meelas, meela, meelast, meelasse, meelaste, meelaid
meeldiv, meeldiva, meeldivat, meeldivasse, meeldivate, meeldivaid
meeleline, meelelise, meelelist, meelelisesse|meelelisse, meeleliste, meelelisi
meeletu, meeletu, meeletut, meeletusse, meeletute, meeletuid
meelik, meeliku, meelikku, meelikusse|meelikku, meelike|meelikkude, meelikke|meelikkusid
meelitav, meelitava, meelitavat, meelitavasse, meelitavate, meelitavaid
meelitlev, meelitleva, meelitlevat, meelitlevasse, meelitlevate, meelitlevaid
meelne, meelse, meelset, meelsesse, meelsete, meelseid
meeskondlik, meeskondliku, meeskondlikku, meeskondlikusse|meeskondlikku, meeskondlike|meeskondlikkude, meeskondlikke|meeskondlikkusid
mehaaniline, mehaanilise, mehaanilist, mehaanilisesse|mehaanilisse, mehaaniliste, mehaanilisi
mehelik, meheliku, mehelikku, mehelikusse|mehelikku, mehelike|mehelikkude, mehelikke|mehelikkusid
mehhaaniline, mehhaanilise, mehhaanilist, mehhaanilisesse|mehhaanilisse, mehhaaniliste, mehhaanilisi
mehine, mehise, mehist, mehisesse, mehiste, mehiseid
meigitu, meigitu, meigitut, meigitusse, meigitute, meigituid
meisterlik, meisterliku, meisterlikku, meisterlikusse|meisterlikku, meisterlike|meisterlikkude, meisterlikke|meisterlikkusid
melanhoolne, melanhoolse, melanhoolset, melanhoolsesse, melanhoolsete, melanhoolseid
meloodiline, meloodilise, meloodilist, meloodilisesse|meloodilisse, meloodiliste, meloodilisi
menševistlik, menševistliku, menševistlikku, menševistlikusse|menševistlikku, menševistlike|menševistlikkude, menševistlikke|menševistlikkusid
mentaalne, mentaalse, mentaalset, mentaalsesse, mentaalsete, mentaalseid
menukas, menuka, menukat, menukasse, menukate, menukaid
menutu, menutu, menutut, menutusse, menutute, menutuid
mereline, merelise, merelist, merelisesse|merelisse, mereliste, merelisi
merenduslik, merendusliku, merenduslikku, merenduslikusse|merenduslikku, merenduslike|merenduslikkude, merenduslikke|merenduslikkusid
merkantiilne, merkantiilse, merkantiilset, merkantiilsesse, merkantiilsete, merkantiilseid
metafüüsiline, metafüüsilise, metafüüsilist, metafüüsilisesse|metafüüsilisse, metafüüsiliste, metafüüsilisi
metoodiline, metoodilise, metoodilist, metoodilisesse|metoodilisse, metoodiliste, metoodilisi
metsakas, metsaka, metsakat, metsakasse, metsakate, metsakaid
metsane, metsase, metsast, metsasesse, metsaste, metsaseid
metsik, metsiku, metsikut, metsikusse, metsikute, metsikuid
metslaslik, metslasliku, metslaslikku, metslaslikusse|metslaslikku, metslaslike|metslaslikkude, metslaslikke|metslaslikkusid
militaarne, militaarse, militaarset, militaarsesse, militaarsete, militaarseid
militaristlik, militaristliku, militaristlikku, militaristlikusse|militaristlikku, militaristlike|militaristlikkude, militaristlikke|militaristlikkusid
minevane, minevase, minevast, minevasesse|minevasse, minevaste, minevasi
minevikuline, minevikulise, minevikulist, minevikulisesse|minevikulisse, minevikuliste, minevikulisi
minev, mineva, minevat, minevasse, minevate, minevaid
mingitu, mingitu, mingitut, mingitusse, mingitute, mingituid
miniatuurne, miniatuurse, miniatuurset, miniatuursesse, miniatuursete, miniatuurseid
minimaalne, minimaalse, minimaalset, minimaalsesse, minimaalsete, minimaalseid
minimalistlik, minimalistliku, minimalistlikku, minimalistlikusse|minimalistlikku, minimalistlike|minimalistlikkude, minimalistlikke|minimalistlikkusid
minoorne, minoorse, minoorset, minoorsesse, minoorsete, minoorseid
mitmuslik, mitmusliku, mitmuslikku, mitmuslikusse|mitmuslikku, mitmuslike|mitmuslikkude, mitmuslikke|mitmuslikkusid
mobiilne, mobiilse, mobiilset, mobiilsesse, mobiilsete, mobiilseid
moderne, moderse, moderset, modersesse, modersete, moderseid
moekas, moeka, moekat, moekasse, moekate, moekaid
mõeldamatu, mõeldamatu, mõeldamatut, mõeldamatusse, mõeldamatute, mõeldamatuid
mõeldav, mõeldava, mõeldavat, mõeldavasse, mõeldavate, mõeldavaid
mõeldu, mõeldu, mõeldut, mõeldusse, mõeldute, mõelduid
moeline, moelise, moelist, moelisesse|moelisse, moeliste, moelisi
moetu, moetu, moetut, moetusse, moetute, moetuid
mõhklik, mõhkliku, mõhklikku, mõhklikusse|mõhklikku, mõhklike|mõhklikkude, mõhklikke|mõhklikkusid
mõistatuslik, mõistatusliku, mõistatuslikku, mõistatuslikusse|mõistatuslikku, mõistatuslike|mõistatuslikkude, mõistatuslikke|mõistatuslikkusid
mõisteline, mõistelise, mõistelist, mõistelisesse|mõistelisse, mõisteliste, mõistelisi
mõistetamatu, mõistetamatu, mõistetamatut, mõistetamatusse, mõistetamatute, mõistetamatuid
mõistetav, mõistetava, mõistetavat, mõistetavasse, mõistetavate, mõistetavaid
mõistev, mõistva, mõistvat, mõistvasse, mõistvate, mõistvaid
mõistlik, mõistliku, mõistlikku, mõistlikusse|mõistlikku, mõistlike|mõistlikkude, mõistlikke|mõistlikkusid
mõistmatu, mõistmatu, mõistmatut, mõistmatusse, mõistmatute, mõistmatuid
mõistuslik, mõistusliku, mõistuslikku, mõistuslikusse|mõistuslikku, mõistuslike|mõistuslikkude, mõistuslikke|mõistuslikkusid
mõjukas, mõjuka, mõjukat, mõjukasse, mõjukate, mõjukaid
mõjus, mõjusa, mõjusat, mõjusasse, mõjusate, mõjusaid
mõjustatu, mõjustatu, mõjustatut, mõjustatusse, mõjustatute, mõjustatuid
mõjutatu, mõjutatu, mõjutatut, mõjutatusse, mõjutatute, mõjutatuid
mõjutu, mõjutu, mõjutut, mõjutusse, mõjutute, mõjutuid
mõjuv, mõjuva, mõjuvat, mõjuvasse, mõjuvate, mõjuvaid
