maksimeerima, maksimeerida, maksimeerib, maksimeeritakse, maksimeerige, maksimeeris, maksimeerinud, maksimeeritud
maksma, maksta, maksab, makstakse, makske, maksis, maksnud, makstud
maksustama, maksustada, maksustab, maksustatakse, maksustage, maksustas, maksustanud, maksustatud
maldama, mallata, maldab, mallatakse, mallake, maldas, mallanud, mallatud
mälestama, mälestada, mälestab, mälestatakse, mälestage, mälestas, mälestanud, mälestatud
maletama, maletada, maletab, maletatakse, maletage, maletas, maletanud, maletatud
mäletama, mäletada, mäletab, mäletatakse, mäletage, mäletas, mäletanud, mäletatud
mäletsema, mäletseda, mäletseb, mäletsetakse, mäletsege, mäletses, mäletsenud, mäletsetud
mäluma, mäluda, mälub, mälutakse, mäluge, mälus, mälunud, mälutud
manama, manada, manab, manatakse, manage, manas, mananud, manatud
manduma, manduda, mandub, mandutakse, manduge, mandus, mandunud, mandutud
maneeritsema, maneeritseda, maneeritseb, maneeritsetakse, maneeritsege, maneeritses, maneeritsenud, maneeritsetud
mängima, mängida, mängib, mängitakse, mängige, mängis, mänginud, mängitud
mängitama, mängitada, mängitab, mängitatakse, mängitage, mängitas, mängitanud, mängitatud
mängitsema, mängitseda, mängitseb, mängitsetakse, mängitsege, mängitses, mängitsenud, mängitsetud
mänglema, mängelda, mängleb, mängeldakse, mängelge, mängles, mängelnud, mängeldud
manguma, manguda, mangub, mangutakse, manguge, mangus, mangunud, mangutud
manifesteerima, manifesteerida, manifesteerib, manifesteeritakse, manifesteerige, manifesteeris, manifesteerinud, manifesteeritud
maniküürima, maniküürida, maniküürib, maniküüritakse, maniküürige, maniküüris, maniküürinud, maniküüritud
manipuleerima, manipuleerida, manipuleerib, manipuleeritakse, manipuleerige, manipuleeris, manipuleerinud, manipuleeritud
manitsema, manitseda, manitseb, manitsetakse, manitsege, manitses, manitsenud, manitsetud
manööverdama, manööverdada, manööverdab, manööverdatakse, manööverdage, manööverdas, manööverdanud, manööverdatud
manustama, manustada, manustab, manustatakse, manustage, manustas, manustanud, manustatud
märatsema, märatseda, märatseb, märatsetakse, märatsege, märatses, märatsenud, märatsetud
märgama, märjata, märgab, märjatakse, märjake, märgas, märjanud, märjatud
märgendama, märgendada, märgendab, märgendatakse, märgendage, märgendas, märgendanud, märgendatud
margistama, margistada, margistab, margistatakse, margistage, margistas, margistanud, margistatud
märgistama, märgistada, märgistab, märgistatakse, märgistage, märgistas, märgistanud, märgistatud
märgitsema, märgitseda, märgitseb, märgitsetakse, märgitsege, märgitses, märgitsenud, märgitsetud
märguma, märguda, märgub, märgutakse, märguge, märgus, märgunud, märgutud
marineerima, marineerida, marineerib, marineeritakse, marineerige, marineeris, marineerinud, marineeritud
märjutama, märjutada, märjutab, märjutatakse, märjutage, märjutas, märjutanud, märjutatud
märkama, märgata, märkab, märgatakse, märgake, märkas, märganud, märgatud
markeerima, markeerida, markeerib, markeeritakse, markeerige, markeeris, markeerinud, markeeritud
märkima, märkida, märgib, märgitakse, märkige, märkis, märkinud, märgitud
marodeerima, marodeerida, marodeerib, marodeeritakse, marodeerige, marodeeris, marodeerinud, marodeeritud
marrastama, marrastada, marrastab, marrastatakse, marrastage, marrastas, marrastanud, marrastatud
marsruutima, marsruutida, marsruudib, marsruuditakse, marsruutige, marsruutis, marsruutinud, marsruuditud
marssima, marssida, marsib, marsitakse, marssige, marssis, marssinud, marsitud
marutsema, marutseda, marutseb, marutsetakse, marutsege, marutses, marutsenud, marutsetud
masendama, masendada, masendab, masendatakse, masendage, masendas, masendanud, masendatud
masenduma, masenduda, masendub, masendutakse, masenduge, masendus, masendunud, masendutud
maskeerima, maskeerida, maskeerib, maskeeritakse, maskeerige, maskeeris, maskeerinud, maskeeritud
maskeeruma, maskeeruda, maskeerub, maskeerutakse, maskeeruge, maskeerus, maskeerunud, maskeerutud
maskuleeruma, maskuleeruda, maskuleerub, maskuleerutakse, maskuleeruge, maskuleerus, maskuleerunud, maskuleerutud
mäslema, mässelda, mäsleb, mässeldakse, mässelge, mäsles, mässelnud, mässeldud
mässama, mässata, mässab, mässatakse, mässake, mässas, mässanud, mässatud
masseerima, masseerida, masseerib, masseeritakse, masseerige, masseeris, masseerinud, masseeritud
massiivistama, massiivistada, massiivistab, massiivistatakse, massiivistage, massiivistas, massiivistanud, massiivistatud
mässima, mässida, mässib, mässitakse, mässige, mässis, mässinud, mässitud
mässuma, mässuda, mässub, mässutakse, mässuge, mässus, mässunud, mässutud
mastaapima, mastaapida, mastaabib, mastaabitakse, mastaapige, mastaapis, mastaapinud, mastaabitud
masturbeerima, masturbeerida, masturbeerib, masturbeeritakse, masturbeerige, masturbeeris, masturbeerinud, masturbeeritud
matematiseerima, matematiseerida, matematiseerib, matematiseeritakse, matematiseerige, matematiseeris, matematiseerinud, matematiseeritud
materdama, materdada, materdab, materdatakse, materdage, materdas, materdanud, materdatud
materialiseerima, materialiseerida, materialiseerib, materialiseeritakse, materialiseerige, materialiseeris, materialiseerinud, materialiseeritud
materialiseeruma, materialiseeruda, materialiseerub, materialiseerutakse, materialiseeruge, materialiseerus, materialiseerunud, materialiseerutud
matistama, matistada, matistab, matistatakse, matistage, matistas, matistanud, matistatud
matistuma, matistuda, matistub, matistutakse, matistuge, matistus, matistunud, matistutud
matkama, matkata, matkab, matkatakse, matkake, matkas, matkanud, matkatud
matkima, matkida, matkib, matkitakse, matkige, matkis, matkinud, matkitud
matma, matta, matab, maetakse, matke, mattis, matnud, maetud
matsatama, matsatada, matsatab, matsatatakse, matsatage, matsatas, matsatanud, matsatatud
mätserdama, mätserdada, mätserdab, mätserdatakse, mätserdage, mätserdas, mätserdanud, mätserdatud
mätsima, mätsida, mätsib, mätsitakse, mätsige, mätsis, mätsinud, mätsitud
matsuma, matsuda, matsub, matsutakse, matsuge, matsus, matsunud, matsutud
matsutama, matsutada, matsutab, matsutatakse, matsutage, matsutas, matsutanud, matsutatud
mätsutama, mätsutada, mätsutab, mätsutatakse, mätsutage, mätsutas, mätsutanud, mätsutatud
mattuma, mattuda, mattub, mattutakse, mattuge, mattus, mattunud, mattutud
mäuguma, mäuguda, mäugub, mäugutakse, mäuguge, mäugus, mäugunud, mäugutud
mediteerima, mediteerida, mediteerib, mediteeritakse, mediteerige, mediteeris, mediteerinud, mediteeritud
meeldima, meeldida, meeldib, meelditakse, meeldige, meeldis, meeldinud, meelditud
meeleolutsema, meeleolutseda, meeleolutseb, meeleolutsetakse, meeleolutsege, meeleolutses, meeleolutsenud, meeleolutsetud
meelestama, meelestada, meelestab, meelestatakse, meelestage, meelestas, meelestanud, meelestatud
meelestuma, meelestuda, meelestub, meelestutakse, meelestuge, meelestus, meelestunud, meelestutud
meelisklema, meeliskleda, meeliskleb, meeliskletakse, meelisklege, meeliskles, meelisklenud, meeliskletud
meelitama, meelitada, meelitab, meelitatakse, meelitage, meelitas, meelitanud, meelitatud
meenuma, meenuda, meenub, meenutakse, meenuge, meenus, meenunud, meenutud
meenutama, meenutada, meenutab, meenutatakse, meenutage, meenutas, meenutanud, meenutatud
mehhaniseerima, mehhaniseerida, mehhaniseerib, mehhaniseeritakse, mehhaniseerige, mehhaniseeris, mehhaniseerinud, mehhaniseeritud
mehhaniseeruma, mehhaniseeruda, mehhaniseerub, mehhaniseerutakse, mehhaniseeruge, mehhaniseerus, mehhaniseerunud, mehhaniseerutud
mehistuma, mehistuda, mehistub, mehistutakse, mehistuge, mehistus, mehistunud, mehistutud
mehitama, mehitada, mehitab, mehitatakse, mehitage, mehitas, mehitanud, mehitatud
mehkeldama, mehkeldada, mehkeldab, mehkeldatakse, mehkeldage, mehkeldas, mehkeldanud, mehkeldatud
meikima, meikida, meigib, meigitakse, meikige, meikis, meikinud, meigitud
meilima, meilida, meilib, meilitakse, meilige, meilis, meilinud, meilitud
meisterdama, meisterdada, meisterdab, meisterdatakse, meisterdage, meisterdas, meisterdanud, meisterdatud
mekkima, mekkida, mekib, mekitakse, mekkige, mekkis, mekkinud, mekitud
mekutama, mekutada, mekutab, mekutatakse, mekutage, mekutas, mekutanud, mekutatud
melanhoolitsema, melanhoolitseda, melanhoolitseb, melanhoolitsetakse, melanhoolitsege, melanhoolitses, melanhoolitsenud, melanhoolitsetud
melanžeerima, melanžeerida, melanžeerib, melanžeeritakse, melanžeerige, melanžeeris, melanžeerinud, melanžeeritud
meldima, meldida, mellib, mellitakse, meldige, meldis, meldinud, mellitud
memoreerima, memoreerida, memoreerib, memoreeritakse, memoreerige, memoreeris, memoreerinud, memoreeritud
menetlema, menetleda, menetleb, menetletakse, menetlege, menetles, menetlenud, menetletud
mestima, mestida, mestib, mestitakse, mestige, mestis, mestinud, mestitud
metalliseerima, metalliseerida, metalliseerib, metalliseeritakse, metalliseerige, metalliseeris, metalliseerinud, metalliseeritud
metallitama, metallitada, metallitab, metallitatakse, metallitage, metallitas, metallitanud, metallitatud
metastaseeruma, metastaseeruda, metastaseerub, metastaseerutakse, metastaseeruge, metastaseerus, metastaseerunud, metastaseerutud
metsistuma, metsistuda, metsistub, metsistutakse, metsistuge, metsistus, metsistunud, metsistutud
migreerima, migreerida, migreerib, migreeritakse, migreerige, migreeris, migreerinud, migreeritud
migreeruma, migreeruda, migreerub, migreerutakse, migreeruge, migreerus, migreerunud, migreerutud
miilustama, miilustada, miilustab, miilustatakse, miilustage, miilustas, miilustanud, miilustatud
mikserdama, mikserdada, mikserdab, mikserdatakse, mikserdage, mikserdas, mikserdanud, mikserdatud
miksima, miksida, miksib, miksitakse, miksige, miksis, miksinud, miksitud
miksitama, miksitada, miksitab, miksitatakse, miksitage, miksitas, miksitanud, miksitatud
militariseerima, militariseerida, militariseerib, militariseeritakse, militariseerige, militariseeris, militariseerinud, militariseeritud
mineerima, mineerida, mineerib, mineeritakse, mineerige, mineeris, mineerinud, mineeritud
minema, minna, läheb, minnakse, minge, läks, läinud, mindud
mineraliseerima, mineraliseerida, mineraliseerib, mineraliseeritakse, mineraliseerige, mineraliseeris, mineraliseerinud, mineraliseeritud
mineraliseeruma, mineraliseeruda, mineraliseerub, mineraliseerutakse, mineraliseeruge, mineraliseerus, mineraliseerunud, mineraliseerutud
minestama, minestada, minestab, minestatakse, minestage, minestas, minestanud, minestatud
minetama, minetada, minetab, minetatakse, minetage, minetas, minetanud, minetatud
minimeerima, minimeerida, minimeerib, minimeeritakse, minimeerige, minimeeris, minimeerinud, minimeeritud
minkima, minkida, mingib, mingitakse, minkige, minkis, minkinud, mingitud
mitmekesistama, mitmekesistada, mitmekesistab, mitmekesistatakse, mitmekesistage, mitmekesistas, mitmekesistanud, mitmekesistatud
mitmekesistuma, mitmekesistuda, mitmekesistub, mitmekesistutakse, mitmekesistuge, mitmekesistus, mitmekesistunud, mitmekesistutud
mitmekordistama, mitmekordistada, mitmekordistab, mitmekordistatakse, mitmekordistage, mitmekordistas, mitmekordistanud, mitmekordistatud
mitmekordistuma, mitmekordistuda, mitmekordistub, mitmekordistutakse, mitmekordistuge, mitmekordistus, mitmekordistunud, mitmekordistutud
mobiliseerima, mobiliseerida, mobiliseerib, mobiliseeritakse, mobiliseerige, mobiliseeris, mobiliseerinud, mobiliseeritud
mobiliseeruma, mobiliseeruda, mobiliseerub, mobiliseerutakse, mobiliseeruge, mobiliseerus, mobiliseerunud, mobiliseerutud
möbleerima, möbleerida, möbleerib, möbleeritakse, möbleerige, möbleeris, möbleerinud, möbleeritud
modelleerima, modelleerida, modelleerib, modelleeritakse, modelleerige, modelleeris, modelleerinud, modelleeritud
modereerima, modereerida, modereerib, modereeritakse, modereerige, modereeris, modereerinud, modereeritud
moderniseerima, moderniseerida, moderniseerib, moderniseeritakse, moderniseerige, moderniseeris, moderniseerinud, moderniseeritud
modernitsema, modernitseda, modernitseb, modernitsetakse, modernitsege, modernitses, modernitsenud, modernitsetud
modifitseerima, modifitseerida, modifitseerib, modifitseeritakse, modifitseerige, modifitseeris, modifitseerinud, modifitseeritud
modifitseeruma, modifitseeruda, modifitseerub, modifitseerutakse, modifitseeruge, modifitseerus, modifitseerunud, modifitseerutud
moduleerima, moduleerida, moduleerib, moduleeritakse, moduleerige, moduleeris, moduleerinud, moduleeritud
mögama, mögada, mögab, mögatakse, mögage, mögas, möganud, mögatud
mögisema, mögiseda, mögiseb, mögisetakse, mögisege, mögises, mögisenud, mögisetud
mögistama, mögistada, mögistab, mögistatakse, mögistage, mögistas, mögistanud, mögistatud
möhitama, möhitada, möhitab, möhitatakse, möhitage, möhitas, möhitanud, möhitatud
mõikama, mõigata, mõikab, mõigatakse, mõigake, mõikas, mõiganud, mõigatud
möiratama, möiratada, möiratab, möiratatakse, möiratage, möiratas, möiratanud, möiratatud
möirgama, möirata, möirgab, möiratakse, möirake, möirgas, möiranud, möiratud
mõisastama, mõisastada, mõisastab, mõisastatakse, mõisastage, mõisastas, mõisastanud, mõisastatud
mõistatama, mõistatada, mõistatab, mõistatatakse, mõistatage, mõistatas, mõistatanud, mõistatatud
mõistma, mõista, mõistab, mõistetakse, mõistke, mõistis, mõistnud, mõistetud
mõistuspärastama, mõistuspärastada, mõistuspärastab, mõistuspärastatakse, mõistuspärastage, mõistuspärastas, mõistuspärastanud, mõistuspärastatud
mõjuma, mõjuda, mõjub, mõjutakse, mõjuge, mõjus, mõjunud, mõjutud
mõjustama, mõjustada, mõjustab, mõjustatakse, mõjustage, mõjustas, mõjustanud, mõjustatud
mõjutama, mõjutada, mõjutab, mõjutatakse, mõjutage, mõjutas, mõjutanud, mõjutatud
mökitama, mökitada, mökitab, mökitatakse, mökitage, mökitas, mökitanud, mökitatud
mökutama, mökutada, mökutab, mökutatakse, mökutage, mökutas, mökutanud, mökutatud
mölama, mölada, mölab, mölatakse, mölage, mölas, mölanud, mölatud
mõlgistama, mõlgistada, mõlgistab, mõlgistatakse, mõlgistage, mõlgistas, mõlgistanud, mõlgistatud
mõlgutama, mõlgutada, mõlgutab, mõlgutatakse, mõlgutage, mõlgutas, mõlgutanud, mõlgutatud
mõlgutlema, mõlgutleda, mõlgutleb, mõlgutletakse, mõlgutlege, mõlgutles, mõlgutlenud, mõlgutletud
mölisema, möliseda, möliseb, mölisetakse, mölisege, mölises, mölisenud, mölisetud
mõlkima, mõlkida, mõlgib, mõlgitakse, mõlkige, mõlkis, mõlkinud, mõlgitud
mõlkuma, mõlkuda, mõlgub, mõlgutakse, mõlkuge, mõlkus, mõlkunud, mõlgutud
möllama, möllata, möllab, möllatakse, möllake, möllas, möllanud, möllatud
molutama, molutada, molutab, molutatakse, molutage, molutas, molutanud, molutatud
mõmahtama, mõmahtada, mõmahtab, mõmahtatakse, mõmahtage, mõmahtas, mõmahtanud, mõmahtatud
mõmatama, mõmatada, mõmatab, mõmatatakse, mõmatage, mõmatas, mõmatanud, mõmatatud
mõmisema, mõmiseda, mõmiseb, mõmisetakse, mõmisege, mõmises, mõmisenud, mõmisetud
mõnitama, mõnitada, mõnitab, mõnitatakse, mõnitage, mõnitas, mõnitanud, mõnitatud
monitoorima, monitoorida, monitoorib, monitooritakse, monitoorige, monitooris, monitoorinud, monitooritud
monologiseerima, monologiseerida, monologiseerib, monologiseeritakse, monologiseerige, monologiseeris, monologiseerinud, monologiseeritud
monopoliseerima, monopoliseerida, monopoliseerib, monopoliseeritakse, monopoliseerige, monopoliseeris, monopoliseerinud, monopoliseeritud
monteerima, monteerida, monteerib, monteeritakse, monteerige, monteeris, monteerinud, monteeritud
mõnulema, mõnuleda, mõnuleb, mõnuletakse, mõnulege, mõnules, mõnulenud, mõnuletud
mööbeldama, mööbeldada, mööbeldab, mööbeldatakse, mööbeldage, mööbeldas, mööbeldanud, mööbeldatud
mööduma, mööduda, möödub, möödutakse, mööduge, möödus, möödunud, möödutud
moodustama, moodustada, moodustab, moodustatakse, moodustage, moodustas, moodustanud, moodustatud
moodustuma, moodustuda, moodustub, moodustutakse, moodustuge, moodustus, moodustunud, moodustutud
möögatama, möögatada, möögatab, möögatatakse, möögatage, möögatas, möögatanud, möögatatud
möögima, möögida, möögib, möögitakse, möögige, möögis, mööginud, möögitud
mõõklema, mõõgelda, mõõkleb, mõõgeldakse, mõõgelge, mõõkles, mõõgelnud, mõõgeldud
moondama, moondada, moondab, moondatakse, moondage, moondas, moondanud, moondatud
moonduma, moonduda, moondub, moondutakse, moonduge, moondus, moondunud, moondutud
möönma, möönda, möönab, mööndakse, möönge, möönis, möönnud, mööndud
moonutama, moonutada, moonutab, moonutatakse, moonutage, moonutas, moonutanud, moonutatud
moorima, moorida, moorib, mooritakse, moorige, mooris, moorinud, mooritud
moosima, moosida, moosib, moositakse, moosige, moosis, moosinud, moositud
mõõtma, mõõta, mõõdab, mõõdetakse, mõõtke, mõõtis, mõõtnud, mõõdetud
moppima, moppida, mopib, mopitakse, moppige, moppis, moppinud, mopitud
moraalitsema, moraalitseda, moraalitseb, moraalitsetakse, moraalitsege, moraalitses, moraalitsenud, moraalitsetud
moraliseerima, moraliseerida, moraliseerib, moraliseeritakse, moraliseerige, moraliseeris, moraliseerinud, moraliseeritud
moraliseeruma, moraliseeruda, moraliseerub, moraliseerutakse, moraliseeruge, moraliseerus, moraliseerunud, moraliseerutud
mõranema, mõraneda, mõraneb, mõranetakse, mõranege, mõranes, mõranenud, mõranetud
mõrastama, mõrastada, mõrastab, mõrastatakse, mõrastage, mõrastas, mõrastanud, mõrastatud
mõrastuma, mõrastuda, mõrastub, mõrastutakse, mõrastuge, mõrastus, mõrastunud, mõrastutud
mörisema, möriseda, möriseb, mörisetakse, mörisege, mörises, mörisenud, mörisetud
morjendama, morjendada, morjendab, morjendatakse, morjendage, morjendas, morjendanud, morjendatud
mornitsema, mornitseda, mornitseb, mornitsetakse, mornitsege, mornitses, mornitsenud, mornitsetud
morsetama, morsetada, morsetab, morsetatakse, morsetage, morsetas, morsetanud, morsetatud
mõrunema, mõruneda, mõruneb, mõrunetakse, mõrunege, mõrunes, mõrunenud, mõrunetud
mõrvama, mõrvata, mõrvab, mõrvatakse, mõrvake, mõrvas, mõrvanud, mõrvatud
mõskma, mõsta, mõseb, mõstakse, mõske, mõskis, mõsknud, mõstud
mossitama, mossitada, mossitab, mossitatakse, mossitage, mossitas, mossitanud, mossitatud
mõtestama, mõtestada, mõtestab, mõtestatakse, mõtestage, mõtestas, mõtestanud, mõtestatud
mõtisklema, mõtiskleda, mõtiskleb, mõtiskletakse, mõtisklege, mõtiskles, mõtisklenud, mõtiskletud
motiveerima, motiveerida, motiveerib, motiveeritakse, motiveerige, motiveeris, motiveerinud, motiveeritud
mõtlema, mõelda|mõtelda, mõtleb, mõeldakse|mõteldakse, mõelge|mõtelge, mõtles, mõelnud|mõtelnud, mõeldud|mõteldud
motoriseerima, motoriseerida, motoriseerib, motoriseeritakse, motoriseerige, motoriseeris, motoriseerinud, motoriseeritud
mudastuma, mudastuda, mudastub, mudastutakse, mudastuge, mudastus, mudastunud, mudastutud
mudeldama, mudeldada, mudeldab, mudeldatakse, mudeldage, mudeldas, mudeldanud, mudeldatud
mudima, mudida, mudib, muditakse, mudige, mudis, mudinud, muditud
müdisema, müdiseda, müdiseb, müdisetakse, müdisege, müdises, müdisenud, müdisetud
müdistama, müdistada, müdistab, müdistatakse, müdistage, müdistas, müdistanud, müdistatud
mugandama, mugandada, mugandab, mugandatakse, mugandage, mugandas, mugandanud, mugandatud
muganduma, muganduda, mugandub, mugandutakse, muganduge, mugandus, mugandunud, mugandutud
muganema, muganeda, muganeb, muganetakse, muganege, muganes, muganenud, muganetud
mugavdama, mugavdada, mugavdab, mugavdatakse, mugavdage, mugavdas, mugavdanud, mugavdatud
mugavnema, mugavneda, mugavneb, mugavnetakse, mugavnege, mugavnes, mugavnenud, mugavnetud
mugeldama, mugeldada, mugeldab, mugeldatakse, mugeldage, mugeldas, mugeldanud, mugeldatud
mugima, mugida, mugib, mugitakse, mugige, mugis, muginud, mugitud
mügistama, mügistada, mügistab, mügistatakse, mügistage, mügistas, mügistanud, mügistatud
mühama, mühada, mühab, mühatakse, mühage, mühas, mühanud, mühatud
mühatama, mühatada, mühatab, mühatatakse, mühatage, mühatas, mühatanud, mühatatud
muhelema, muhelda|muheleda, muheleb, muheldakse|muheletakse, muhelge|muhelege, muheles, muhelnud|muhelenud, muheldud|muheletud
muhendama, muhendada, muhendab, muhendatakse, muhendage, muhendas, muhendanud, muhendatud
muhenema, muheneda, muheneb, muhenetakse, muhenege, muhenes, muhenenud, muhenetud
mühisema, mühiseda, mühiseb, mühisetakse, mühisege, mühises, mühisenud, mühisetud
muiatama, muiatada, muiatab, muiatatakse, muiatage, muiatas, muiatanud, muiatatud
muigama, muiata, muigab, muiatakse, muiake, muigas, muianud, muiatud
muigutama, muigutada, muigutab, muigutatakse, muigutage, muigutas, muigutanud, muigutatud
mükerdama, mükerdada, mükerdab, mükerdatakse, mükerdage, mükerdas, mükerdanud, mükerdatud
mukkima, mukkida, mukib, mukitakse, mukkige, mukkis, mukkinud, mukitud
müksama, müksata, müksab, müksatakse, müksake, müksas, müksanud, müksatud
müksima, müksida, müksib, müksitakse, müksige, müksis, müksinud, müksitud
mulama, mulada, mulab, mulatakse, mulage, mulas, mulanud, mulatud
muldama, mullata, muldab, mullatakse, mullake, muldas, mullanud, mullatud
mulgustama, mulgustada, mulgustab, mulgustatakse, mulgustage, mulgustas, mulgustanud, mulgustatud
mulgustuma, mulgustuda, mulgustub, mulgustutakse, mulgustuge, mulgustus, mulgustunud, mulgustutud
mulisema, muliseda, muliseb, mulisetakse, mulisege, mulises, mulisenud, mulisetud
mulistama, mulistada, mulistab, mulistatakse, mulistage, mulistas, mulistanud, mulistatud
muljetama, muljetada, muljetab, muljetatakse, muljetage, muljetas, muljetanud, muljetatud
muljuma, muljuda, muljub, muljutakse, muljuge, muljus, muljunud, muljutud
mulksatama, mulksatada, mulksatab, mulksatatakse, mulksatage, mulksatas, mulksatanud, mulksatatud
mulksuma, mulksuda, mulksub, mulksutakse, mulksuge, mulksus, mulksunud, mulksutud
mulksutama, mulksutada, mulksutab, mulksutatakse, mulksutage, mulksutas, mulksutanud, mulksutatud
mullastuma, mullastuda, mullastub, mullastutakse, mullastuge, mullastus, mullastunud, mullastutud
mullatama, mullatada, mullatab, mullatatakse, mullatage, mullatas, mullatanud, mullatatud
mullitama, mullitada, mullitab, mullitatakse, mullitage, mullitas, mullitanud, mullitatud
multiplitseerima, multiplitseerida, multiplitseerib, multiplitseeritakse, multiplitseerige, multiplitseeris, multiplitseerinud, multiplitseeritud
mumifitseerima, mumifitseerida, mumifitseerib, mumifitseeritakse, mumifitseerige, mumifitseeris, mumifitseerinud, mumifitseeritud
mumifitseeruma, mumifitseeruda, mumifitseerub, mumifitseerutakse, mumifitseeruge, mumifitseerus, mumifitseerunud, mumifitseerutud
munema, muneda, muneb, munetakse, munege, munes, munenud, munetud
munitsipaliseerima, munitsipaliseerida, munitsipaliseerib, munitsipaliseeritakse, munitsipaliseerige, munitsipaliseeris, munitsipaliseerinud, munitsipaliseeritud
munsterdama, munsterdada, munsterdab, munsterdatakse, munsterdage, munsterdas, munsterdanud, munsterdatud
müntima, müntida, mündib, münditakse, müntige, müntis, müntinud, münditud
mürama, mürada, mürab, müratakse, mürage, müras, müranud, müratud
murdma, murda, murrab, murtakse, murdke, murdis, murdnud, murtud
murduma, murduda, murdub, murdutakse, murduge, murdus, murdunud, murdutud
murendama, murendada, murendab, murendatakse, murendage, murendas, murendanud, murendatud
murenema, mureneda, mureneb, murenetakse, murenege, murenes, murenenud, murenetud
muretsema, muretseda, muretseb, muretsetakse, muretsege, muretses, muretsenud, muretsetud
mürgeldama, mürgeldada, mürgeldab, mürgeldatakse, mürgeldage, mürgeldas, mürgeldanud, mürgeldatud
mürgistama, mürgistada, mürgistab, mürgistatakse, mürgistage, mürgistas, mürgistanud, mürgistatud
mürgistuma, mürgistuda, mürgistub, mürgistutakse, mürgistuge, mürgistus, mürgistunud, mürgistutud
mürgitama, mürgitada, mürgitab, mürgitatakse, mürgitage, mürgitas, mürgitanud, mürgitatud
mürgituma, mürgituda, mürgitub, mürgitutakse, mürgituge, mürgitus, mürgitunud, mürgitutud
mürisema, müriseda, müriseb, mürisetakse, mürisege, mürises, mürisenud, mürisetud
müristama, müristada, müristab, müristatakse, müristage, müristas, müristanud, müristatud
mürtsatama, mürtsatada, mürtsatab, mürtsatatakse, mürtsatage, mürtsatas, mürtsatanud, mürtsatatud
mürtsuma, mürtsuda, mürtsub, mürtsutakse, mürtsuge, mürtsus, mürtsunud, mürtsutud
mürtsutama, mürtsutada, mürtsutab, mürtsutatakse, mürtsutage, mürtsutas, mürtsutanud, mürtsutatud
muserdama, muserdada, muserdab, muserdatakse, muserdage, muserdas, muserdanud, muserdatud
musitama, musitada, musitab, musitatakse, musitage, musitas, musitanud, musitatud
musitseerima, musitseerida, musitseerib, musitseeritakse, musitseerige, musitseeris, musitseerinud, musitseeritud
mustama, mustata, mustab, mustatakse, mustake, mustas, mustanud, mustatud
mustendama, mustendada, mustendab, mustendatakse, mustendage, mustendas, mustendanud, mustendatud
mustenema, musteneda, musteneb, mustenetakse, mustenege, mustenes, mustenenud, mustenetud
müstifitseerima, müstifitseerida, müstifitseerib, müstifitseeritakse, müstifitseerige, müstifitseeris, müstifitseerinud, müstifitseeritud
mustuma, mustuda, mustub, mustutakse, mustuge, mustus, mustunud, mustutud
musutama, musutada, musutab, musutatakse, musutage, musutas, musutanud, musutatud
muteeruma, muteeruda, muteerub, muteerutakse, muteeruge, muteerus, muteerunud, muteerutud
