käendama, käendada, käendab, käendatakse, käendage, käendas, käendanud, käendatud
kaetama, kaetada, kaetab, kaetatakse, kaetage, kaetas, kaetanud, kaetatud
kaevama, kaevata, kaevab, kaevatakse, kaevake, kaevas, kaevanud, kaevatud
kaevandama, kaevandada, kaevandab, kaevandatakse, kaevandage, kaevandas, kaevandanud, kaevandatud
kaevuma, kaevuda, kaevub, kaevutakse, kaevuge, kaevus, kaevunud, kaevutud
kägardama, kägardada, kägardab, kägardatakse, kägardage, kägardas, kägardanud, kägardatud
kägarduma, kägarduda, kägardub, kägardutakse, kägarduge, kägardus, kägardunud, kägardutud
kägisema, kägiseda, kägiseb, kägisetakse, kägisege, kägises, kägisenud, kägisetud
kägistama, kägistada, kägistab, kägistatakse, kägistage, kägistas, kägistanud, kägistatud
kägrutama, kägrutada, kägrutab, kägrutatakse, kägrutage, kägrutas, kägrutanud, kägrutatud
kahandama, kahandada, kahandab, kahandatakse, kahandage, kahandas, kahandanud, kahandatud
kahanema, kahaneda, kahaneb, kahanetakse, kahanege, kahanes, kahanenud, kahanetud
kähardama, kähardada, kähardab, kähardatakse, kähardage, kähardas, kähardanud, kähardatud
käharduma, käharduda, kähardub, kähardutakse, käharduge, kähardus, kähardunud, kähardutud
kahekordistama, kahekordistada, kahekordistab, kahekordistatakse, kahekordistage, kahekordistas, kahekordistanud, kahekordistatud
kahekordistuma, kahekordistuda, kahekordistub, kahekordistutakse, kahekordistuge, kahekordistus, kahekordistunud, kahekordistutud
kaheksakordistama, kaheksakordistada, kaheksakordistab, kaheksakordistatakse, kaheksakordistage, kaheksakordistas, kaheksakordistanud, kaheksakordistatud
kahekskordistuma, kahekskordistuda, kahekskordistub, kahekskordistutakse, kahekskordistuge, kahekskordistus, kahekskordistunud, kahekskordistutud
kahestama, kahestada, kahestab, kahestatakse, kahestage, kahestas, kahestanud, kahestatud
kahestuma, kahestuda, kahestub, kahestutakse, kahestuge, kahestus, kahestunud, kahestutud
kahetama, kahetada, kahetab, kahetatakse, kahetage, kahetas, kahetanud, kahetatud
kahetsema, kahetseda, kahetseb, kahetsetakse, kahetsege, kahetses, kahetsenud, kahetsetud
kahisema, kahiseda, kahiseb, kahisetakse, kahisege, kahises, kahisenud, kahisetud
kähisema, kähiseda, kähiseb, kähisetakse, kähisege, kähises, kähisenud, kähisetud
kahistama, kahistada, kahistab, kahistatakse, kahistage, kahistas, kahistanud, kahistatud
kahjurõõmutsema, kahjurõõmutseda, kahjurõõmutseb, kahjurõõmutsetakse, kahjurõõmutsege, kahjurõõmutses, kahjurõõmutsenud, kahjurõõmutsetud
kahjustama, kahjustada, kahjustab, kahjustatakse, kahjustage, kahjustas, kahjustanud, kahjustatud
kahjustuma, kahjustuda, kahjustub, kahjustutakse, kahjustuge, kahjustus, kahjustunud, kahjustutud
kahjutustama, kahjutustada, kahjutustab, kahjutustatakse, kahjutustage, kahjutustas, kahjutustanud, kahjutustatud
kahklema, kahelda, kahkleb, kaheldakse, kahelge, kahkles, kahelnud, kaheldud
kahlama, kahlata, kahlab, kahlatakse, kahlake, kahlas, kahlanud, kahlatud
kahmama, kahmata, kahmab, kahmatakse, kahmake, kahmas, kahmanud, kahmatud
kähmlema, kähmelda, kähmleb, kähmeldakse, kähmelge, kähmles, kähmelnud, kähmeldud
kahtlema, kahelda, kahtleb, kaheldakse, kahelge, kahtles, kahelnud, kaheldud
kahtlustama, kahtlustada, kahtlustab, kahtlustatakse, kahtlustage, kahtlustas, kahtlustanud, kahtlustatud
kahutama, kahutada, kahutab, kahutatakse, kahutage, kahutas, kahutanud, kahutatud
kähvama, kähvata, kähvab, kähvatakse, kähvake, kähvas, kähvanud, kähvatud
kahvatama, kahvatada, kahvatab, kahvatatakse, kahvatage, kahvatas, kahvatanud, kahvatatud
kahvatuma, kahvatuda, kahvatub, kahvatutakse, kahvatuge, kahvatus, kahvatunud, kahvatutud
käiama, käiata, käiab, käiatakse, käiake, käias, käianud, käiatud
käibima, käibida, käibib, käibitakse, käibige, käibis, käibinud, käibitud
kaikuma, kaikuda, kaigub|kaikub, kaigutakse|kaikutakse, kaikuge, kaikus, kaikunud, kaigutud|kaikutud
käima, käia, käib, käiakse, käige, käis, käinud, käidud
kainendama, kainendada, kainendab, kainendatakse, kainendage, kainendas, kainendanud, kainendatud
kainenema, kaineneda, kaineneb, kainenetakse, kainenege, kainenes, kainenenud, kainenetud
kainestama, kainestada, kainestab, kainestatakse, kainestage, kainestas, kainestanud, kainestatud
kainestuma, kainestuda, kainestub, kainestutakse, kainestuge, kainestus, kainestunud, kainestutud
kaisutama, kaisutada, kaisutab, kaisutatakse, kaisutage, kaisutas, kaisutanud, kaisutatud
käitama, käitada, käitab, käitatakse, käitage, käitas, käitanud, käitatud
käitlema, käidelda, käitleb, käideldakse, käidelge, käitles, käidelnud, käideldud
kaitsepookima, kaitsepookida, kaitsepoogib, kaitsepoogitakse, kaitsepookige, kaitsepookis, kaitsepookinud, kaitsepoogitud
kaitsma, kaitsta, kaitseb, kaitstakse, kaitske, kaitses, kaitsnud, kaitstud
käituma, käituda, käitub, käitutakse, käituge, käitus, käitunud, käitutud
käivitama, käivitada, käivitab, käivitatakse, käivitage, käivitas, käivitanud, käivitatud
käivituma, käivituda, käivitub, käivitutakse, käivituge, käivitus, käivitunud, käivitutud
kajama, kajada, kajab, kajatakse, kajage, kajas, kajanud, kajatud
kajastama, kajastada, kajastab, kajastatakse, kajastage, kajastas, kajastanud, kajastatud
kajastuma, kajastuda, kajastub, kajastutakse, kajastuge, kajastus, kajastunud, kajastutud
kakerdama, kakerdada, kakerdab, kakerdatakse, kakerdage, kakerdas, kakerdanud, kakerdatud
käkerdama, käkerdada, käkerdab, käkerdatakse, käkerdage, käkerdas, käkerdanud, käkerdatud
käkerduma, käkerduda, käkerdub, käkerdutakse, käkerduge, käkerdus, käkerdunud, käkerdutud
kakima, kakida, kakib, kakitakse, kakige, kakis, kakinud, kakitud
kaklema, kakelda, kakleb, kakeldakse, kakelge, kakles, kakelnud, kakeldud
käkruma, käkruda, käkrub, käkrutakse, käkruge, käkrus, käkrunud, käkrutud
kaksama, kaksata, kaksab, kaksatakse, kaksake, kaksas, kaksanud, kaksatud
kalambuuritsema, kalambuuritseda, kalambuuritseb, kalambuuritsetakse, kalambuuritsege, kalambuuritses, kalambuuritsenud, kalambuuritsetud
kalastama, kalastada, kalastab, kalastatakse, kalastage, kalastas, kalastanud, kalastatud
kalduma, kalduda, kaldub, kaldutakse, kalduge, kaldus, kaldunud, kaldutud
kalestama, kalestada, kalestab, kalestatakse, kalestage, kalestas, kalestanud, kalestatud
kalestuma, kalestuda, kalestub, kalestutakse, kalestuge, kalestus, kalestunud, kalestutud
kalgendama, kalgendada, kalgendab, kalgendatakse, kalgendage, kalgendas, kalgendanud, kalgendatud
kalgenduma, kalgenduda, kalgendub, kalgendutakse, kalgenduge, kalgendus, kalgendunud, kalgendutud
kalgistama, kalgistada, kalgistab, kalgistatakse, kalgistage, kalgistas, kalgistanud, kalgistatud
kalgistuma, kalgistuda, kalgistub, kalgistutakse, kalgistuge, kalgistus, kalgistunud, kalgistutud
kalibreerima, kalibreerida, kalibreerib, kalibreeritakse, kalibreerige, kalibreeris, kalibreerinud, kalibreeritud
kaliibrima, kaliibrida, kaliibrib, kaliibritakse, kaliibrige, kaliibris, kaliibrinud, kaliibritud
kalkuleerima, kalkuleerida, kalkuleerib, kalkuleeritakse, kalkuleerige, kalkuleeris, kalkuleerinud, kalkuleeritud
kallama, kallata, kallab, kallatakse, kallake, kallas, kallanud, kallatud
kallerdama, kallerdada, kallerdab, kallerdatakse, kallerdage, kallerdas, kallerdanud, kallerdatud
kallerduma, kallerduda, kallerdub, kallerdutakse, kallerduge, kallerdus, kallerdunud, kallerdutud
kallinema, kallineda, kallineb, kallinetakse, kallinege, kallines, kallinenud, kallinetud
kallistama, kallistada, kallistab, kallistatakse, kallistage, kallistas, kallistanud, kallistatud
kallutama, kallutada, kallutab, kallutatakse, kallutage, kallutas, kallutanud, kallutatud
kallutuma, kallutuda, kallutub, kallututakse, kallutuge, kallutus, kallutunud, kallututud
kalpsama, kalpsata, kalpsab, kalpsatakse, kalpsake, kalpsas, kalpsanud, kalpsatud
kaltsineerima, kaltsineerida, kaltsineerib, kaltsineeritakse, kaltsineerige, kaltsineeris, kaltsineerinud, kaltsineeritud
kaltsutama, kaltsutada, kaltsutab, kaltsutatakse, kaltsutage, kaltsutas, kaltsutanud, kaltsutatud
kamandama, kamandada, kamandab, kamandatakse, kamandage, kamandas, kamandanud, kamandatud
kamarduma, kamarduda, kamardub, kamardutakse, kamarduge, kamardus, kamardunud, kamardutud
kammima, kammida, kammib, kammitakse, kammige, kammis, kamminud, kammitud
kammitsema, kammitseda, kammitseb, kammitsetakse, kammitsege, kammitses, kammitsenud, kammitsetud
kämpuma, kämpuda, kämpub, kämputakse, kämpuge, kämpus, kämpunud, kämputud
kanaliseerima, kanaliseerida, kanaliseerib, kanaliseeritakse, kanaliseerige, kanaliseeris, kanaliseerinud, kanaliseeritud
kandideerima, kandideerida, kandideerib, kandideeritakse, kandideerige, kandideeris, kandideerinud, kandideeritud
kandma, kanda, kannab, kantakse, kandke, kandis, kandnud, kantud
kanduma, kanduda, kandub, kandutakse, kanduge, kandus, kandunud, kandutud
kangastama, kangastada, kangastab, kangastatakse, kangastage, kangastas, kangastanud, kangastatud
kangastuma, kangastuda, kangastub, kangastutakse, kangastuge, kangastus, kangastunud, kangastutud
kangema, kangeda, kangeb, kangetakse, kangege, kanges, kangenud, kangetud
kangenema, kangeneda, kangeneb, kangenetakse, kangenege, kangenes, kangenenud, kangenetud
kangestama, kangestada, kangestab, kangestatakse, kangestage, kangestas, kangestanud, kangestatud
kangestuma, kangestuda, kangestub, kangestutakse, kangestuge, kangestus, kangestunud, kangestutud
kängima, kängida, kängib, kängitakse, kängige, kängis, känginud, kängitud
kängitsema, kängitseda, kängitseb, kängitsetakse, kängitsege, kängitses, kängitsenud, kängitsetud
kanguma, kanguda, kangub, kangutakse, kanguge, kangus, kangunud, kangutud
känguma, känguda, kängub, kängutakse, känguge, kängus, kängunud, kängutud
kangutama, kangutada, kangutab, kangutatakse, kangutage, kangutas, kangutanud, kangutatud
kannatama, kannatada, kannatab, kannatatakse, kannatage, kannatas, kannatanud, kannatatud
kanneldama, kanneldada, kanneldab, kanneldatakse, kanneldage, kanneldas, kanneldanud, kanneldatud
kannustama, kannustada, kannustab, kannustatakse, kannustage, kannustas, kannustanud, kannustatud
kanoniseerima, kanoniseerida, kanoniseerib, kanoniseeritakse, kanoniseerige, kanoniseeris, kanoniseerinud, kanoniseeritud
kantima, kantida, kandib, kanditakse, kantige, kantis, kantinud, kanditud
kantseldama, kantseldada, kantseldab, kantseldatakse, kantseldage, kantseldas, kantseldanud, kantseldatud
kantsitama, kantsitada, kantsitab, kantsitatakse, kantsitage, kantsitas, kantsitanud, kantsitatud
kaotama, kaotada, kaotab, kaotatakse, kaotage, kaotas, kaotanud, kaotatud
käperdama, käperdada, käperdab, käperdatakse, käperdage, käperdas, käperdanud, käperdatud
kapitaliseerima, kapitaliseerida, kapitaliseerib, kapitaliseeritakse, kapitaliseerige, kapitaliseeris, kapitaliseerinud, kapitaliseeritud
kapitaliseeruma, kapitaliseeruda, kapitaliseerub, kapitaliseerutakse, kapitaliseeruge, kapitaliseerus, kapitaliseerunud, kapitaliseerutud
kapituleeruma, kapituleeruda, kapituleerub, kapituleerutakse, kapituleeruge, kapituleerus, kapituleerunud, kapituleerutud
kappama, kapata, kappab, kapatakse, kapake, kappas, kapanud, kapatud
kappima, kappida, kapib, kapitakse, kappige, kappis, kappinud, kapitud
käppima, käppida, käpib, käpitakse, käppige, käppis, käppinud, käpitud
kapriisitsema, kapriisitseda, kapriisitseb, kapriisitsetakse, kapriisitsege, kapriisitses, kapriisitsenud, kapriisitsetud
kapsama, kapsata, kapsab, kapsatakse, kapsake, kapsas, kapsanud, kapsatud
kapseldama, kapseldada, kapseldab, kapseldatakse, kapseldage, kapseldas, kapseldanud, kapseldatud
kapselduma, kapselduda, kapseldub, kapseldutakse, kapselduge, kapseldus, kapseldunud, kapseldutud
kapslema, kapselda, kapsleb, kapseldakse, kapselge, kapsles, kapselnud, kapseldud
karakteriseerima, karakteriseerida, karakteriseerib, karakteriseeritakse, karakteriseerige, karakteriseeris, karakteriseerinud, karakteriseeritud
kärama, kärada, kärab, käratakse, kärage, käras, käranud, käratud
karamellistama, karamellistada, karamellistab, karamellistatakse, karamellistage, karamellistas, karamellistanud, karamellistatud
karamellistuma, karamellistuda, karamellistub, karamellistutakse, karamellistuge, karamellistus, karamellistunud, karamellistutud
karastama, karastada, karastab, karastatakse, karastage, karastas, karastanud, karastatud
karastuma, karastuda, karastub, karastutakse, karastuge, karastus, karastunud, karastutud
käratama, käratada, käratab, käratatakse, käratage, käratas, käratanud, käratatud
käratsema, käratseda, käratseb, käratsetakse, käratsege, käratses, käratsenud, käratsetud
karboniseerima, karboniseerida, karboniseerib, karboniseeritakse, karboniseerige, karboniseeris, karboniseerinud, karboniseeritud
kärbuma, kärbuda, kärbub, kärbutakse, kärbuge, kärbus, kärbunud, kärbutud
karestama, karestada, karestab, karestatakse, karestage, karestas, karestanud, karestatud
karestuma, karestuda, karestub, karestutakse, karestuge, karestus, karestunud, karestutud
kargama, karata, kargab, karatakse, karake, kargas, karanud, karatud
kärgatama, kärgatada, kärgatab, kärgatatakse, kärgatage, kärgatas, kärgatanud, kärgatatud
karglema, karelda, kargleb, kareldakse, karelge, kargles, karelnud, kareldud
karguma, karguda, kargub, kargutakse, karguge, kargus, kargunud, kargutud
karikeerima, karikeerida, karikeerib, karikeeritakse, karikeerige, karikeeris, karikeerinud, karikeeritud
kärisema, käriseda, käriseb, kärisetakse, kärisege, kärises, kärisenud, kärisetud
karistama, karistada, karistab, karistatakse, karistage, karistas, karistanud, karistatud
käristama, käristada, käristab, käristatakse, käristage, käristas, käristanud, käristatud
karjahtama, karjahtada, karjahtab, karjahtatakse, karjahtage, karjahtas, karjahtanud, karjahtatud
karjatama, karjatada, karjatab, karjatatakse, karjatage, karjatas, karjatanud, karjatatud
karjuma, karjuda, karjub, karjutakse, karjuge, karjus, karjunud, karjutud
karjutama, karjutada, karjutab, karjutatakse, karjutage, karjutas, karjutanud, karjutatud
kärkima, kärkida, kärgib, kärgitakse, kärkige, kärkis, kärkinud, kärgitud
karminema, karmineda, karmineb, karminetakse, karminege, karmines, karminenud, karminetud
karmistama, karmistada, karmistab, karmistatakse, karmistage, karmistas, karmistanud, karmistatud
karmistuma, karmistuda, karmistub, karmistutakse, karmistuge, karmistus, karmistunud, karmistutud
kärpima, kärpida, kärbib, kärbitakse, kärpige, kärpis, kärpinud, kärbitud
kärsatama, kärsatada, kärsatab, kärsatatakse, kärsatage, kärsatas, kärsatanud, kärsatatud
kärssama, kärsata, kärssab, kärsatakse, kärsake, kärssas, kärsanud, kärsatud
kärsutama, kärsutada, kärsutab, kärsutatakse, kärsutage, kärsutas, kärsutanud, kärsutatud
kartma, karta, kardab, kardetakse, kartke, kartis, kartnud, kardetud
kartografeerima, kartografeerida, kartografeerib, kartografeeritakse, kartografeerige, kartografeeris, kartografeerinud, kartografeeritud
kartoteekima, kartoteekida, kartoteegib, kartoteegitakse, kartoteekige, kartoteekis, kartoteekinud, kartoteegitud
karustama, karustada, karustab, karustatakse, karustage, karustas, karustanud, karustatud
kärutama, kärutada, kärutab, kärutatakse, kärutage, kärutas, kärutanud, kärutatud
kärvama, kärvata, kärvab, kärvatakse, kärvake, kärvas, kärvanud, kärvatud
karvastama, karvastada, karvastab, karvastatakse, karvastage, karvastas, karvastanud, karvastatud
karvastuma, karvastuda, karvastub, karvastutakse, karvastuge, karvastus, karvastunud, karvastutud
karvuma, karvuda, karvub, karvutakse, karvuge, karvus, karvunud, karvutud
käsikiimlema, käsikiimelda, käsikiimleb, käsikiimeldakse, käsikiimelge, käsikiimles, käsikiimelnud, käsikiimeldud
kasima, kasida, kasib, kasitakse, kasige, kasis, kasinud, kasitud
käsitama, käsitada, käsitab, käsitatakse, käsitage, käsitas, käsitanud, käsitatud
käsitlema, käsitleda, käsitleb, käsitletakse, käsitlege, käsitles, käsitlenud, käsitletud
käsitsema, käsitseda, käsitseb, käsitsetakse, käsitsege, käsitses, käsitsenud, käsitsetud
käskima, käskida, käsib, kästakse, käskige, käskis, käskinud, kästud
kasseerima, kasseerida, kasseerib, kasseeritakse, kasseerige, kasseeris, kasseerinud, kasseeritud
kastma, kasta, kastab, kastetakse, kastke, kastis, kastnud, kastetud
kastreerima, kastreerida, kastreerib, kastreeritakse, kastreerige, kastreeris, kastreerinud, kastreeritud
käsundama, käsundada, käsundab, käsundatakse, käsundage, käsundas, käsundanud, käsundatud
kasutama, kasutada, kasutab, kasutatakse, kasutage, kasutas, kasutanud, kasutatud
käsutama, käsutada, käsutab, käsutatakse, käsutage, käsutas, käsutanud, käsutatud
kasvama, kasvada, kasvab, kasvatakse, kasvage, kasvas, kasvanud, kasvatud
kasvatama, kasvatada, kasvatab, kasvatatakse, kasvatage, kasvatas, kasvatanud, kasvatatud
katalogiseerima, katalogiseerida, katalogiseerib, katalogiseeritakse, katalogiseerige, katalogiseeris, katalogiseerinud, katalogiseeritud
kataloogima, kataloogida, kataloogib, kataloogitakse, kataloogige, kataloogis, katalooginud, kataloogitud
katalüüsima, katalüüsida, katalüüsib, katalüüsitakse, katalüüsige, katalüüsis, katalüüsinud, katalüüsitud
katapulteerima, katapulteerida, katapulteerib, katapulteeritakse, katapulteerige, katapulteeris, katapulteerinud, katapulteeritud
katapulteeruma, katapulteeruda, katapulteerub, katapulteerutakse, katapulteeruge, katapulteerus, katapulteerunud, katapulteerutud
katapultima, katapultida, katapuldib, katapulditakse, katapultige, katapultis, katapultinud, katapulditud
katastreerima, katastreerida, katastreerib, katastreeritakse, katastreerige, katastreeris, katastreerinud, katastreeritud
kategoriseerima, kategoriseerida, kategoriseerib, kategoriseeritakse, kategoriseerige, kategoriseeris, kategoriseerinud, kategoriseeritud
katkema, katkeda, katkeb, katketakse, katkege, katkes, katkenud, katketud
kätkema, kätkeda, kätkeb, kätketakse, kätkege, kätkes, kätkenud, kätketud
katkestama, katkestada, katkestab, katkestatakse, katkestage, katkestas, katkestanud, katkestatud
katkestuma, katkestuda, katkestub, katkestutakse, katkestuge, katkestus, katkestunud, katkestutud
katkuma, katkuda, katkub, katkutakse, katkuge, katkus, katkunud, katkutud
kätlema, kätelda, kätleb, käteldakse, kätelge, kätles, kätelnud, käteldud
katma, katta, katab, kaetakse, katke, kattis, katnud, kaetud
katoliseerima, katoliseerida, katoliseerib, katoliseeritakse, katoliseerige, katoliseeris, katoliseerinud, katoliseeritud
kätsatama, kätsatada, kätsatab, kätsatatakse, kätsatage, kätsatas, kätsatanud, kätsatatud
katsetama, katsetada, katsetab, katsetatakse, katsetage, katsetas, katsetanud, katsetatud
katsuma, katsuda, katsub, katsutakse, katsuge, katsus, katsunud, katsutud
kattuma, kattuda, kattub, kattutakse, kattuge, kattus, kattunud, kattutud
kaubareisima, kaubareisida, kaubareisib, kaubareisitakse, kaubareisige, kaubareisis, kaubareisinud, kaubareisitud
kaubitsema, kaubitseda, kaubitseb, kaubitsetakse, kaubitsege, kaubitses, kaubitsenud, kaubitsetud
kaugenema, kaugeneda, kaugeneb, kaugenetakse, kaugenege, kaugenes, kaugenenud, kaugenetud
kauguma, kauguda, kaugub, kaugutakse, kauguge, kaugus, kaugunud, kaugutud
käuksatama, käuksatada, käuksatab, käuksatatakse, käuksatage, käuksatas, käuksatanud, käuksatatud
käuksutama, käuksutada, käuksutab, käuksutatakse, käuksutage, käuksutas, käuksutanud, käuksutatud
kauninema, kaunineda, kaunineb, kauninetakse, kauninege, kaunines, kauninenud, kauninetud
kaunistama, kaunistada, kaunistab, kaunistatakse, kaunistage, kaunistas, kaunistanud, kaunistatud
käunutama, käunutada, käunutab, käunutatakse, käunutage, käunutas, käunutanud, käunutatud
kauplema, kaubelda, kaupleb, kaubeldakse, kaubelge, kauples, kaubelnud, kaubeldud
kavaldama, kavaldada, kavaldab, kavaldatakse, kavaldage, kavaldas, kavaldanud, kavaldatud
kavandama, kavandada, kavandab, kavandatakse, kavandage, kavandas, kavandanud, kavandatud
kavastama, kavastada, kavastab, kavastatakse, kavastage, kavastas, kavastanud, kavastatud
kavatsema, kavatseda, kavatseb, kavatsetakse, kavatsege, kavatses, kavatsenud, kavatsetud
kebima, kebida, kebib, kebitakse, kebige, kebis, kebinud, kebitud
keelama, keelata, keelab, keelatakse, keelake, keelas, keelanud, keelatud
keelduma, keelduda, keeldub, keeldutakse, keelduge, keeldus, keeldunud, keeldutud
keelestama, keelestada, keelestab, keelestatakse, keelestage, keelestas, keelestanud, keelestatud
keelitama, keelitada, keelitab, keelitatakse, keelitage, keelitas, keelitanud, keelitatud
keelitlema, keelitleda, keelitleb, keelitletakse, keelitlege, keelitles, keelitlenud, keelitletud
keelustama, keelustada, keelustab, keelustatakse, keelustage, keelustas, keelustanud, keelustatud
keema, keeda, keeb, keedakse, keege, kees, keenud, keedud
keerama, keerata, keerab, keeratakse, keerake, keeras, keeranud, keeratud
keerduma, keerduda, keerdub, keerdutakse, keerduge, keerdus, keerdunud, keerdutud
keerlema, keerelda, keerleb, keereldakse, keerelge, keerles, keerelnud, keereldud
keerustama, keerustada, keerustab, keerustatakse, keerustage, keerustas, keerustanud, keerustatud
keerustuma, keerustuda, keerustub, keerustutakse, keerustuge, keerustus, keerustunud, keerustutud
keerutama, keerutada, keerutab, keerutatakse, keerutage, keerutas, keerutanud, keerutatud
keetma, keeta, keedab, keedetakse, keetke, keetis, keetnud, keedetud
keevitama, keevitada, keevitab, keevitatakse, keevitage, keevitas, keevitanud, keevitatud
keevituma, keevituda, keevitub, keevitutakse, keevituge, keevitus, keevitunud, keevitutud
kehastama, kehastada, kehastab, kehastatakse, kehastage, kehastas, kehastanud, kehastatud
kehastuma, kehastuda, kehastub, kehastutakse, kehastuge, kehastus, kehastunud, kehastutud
kehitama, kehitada, kehitab, kehitatakse, kehitage, kehitas, kehitanud, kehitatud
kehklema, kehelda, kehkleb, keheldakse, kehelge, kehkles, kehelnud, keheldud
kehtestama, kehtestada, kehtestab, kehtestatakse, kehtestage, kehtestas, kehtestanud, kehtestatud
kehtestuma, kehtestuda, kehtestub, kehtestutakse, kehtestuge, kehtestus, kehtestunud, kehtestutud
kehtima, kehtida, kehtib, kehtitakse, kehtige, kehtis, kehtinud, kehtitud
kehutama, kehutada, kehutab, kehutatakse, kehutage, kehutas, kehutanud, kehutatud
kehvenema, kehveneda, kehveneb, kehvenetakse, kehvenege, kehvenes, kehvenenud, kehvenetud
kehvuma, kehvuda, kehvub, kehvutakse, kehvuge, kehvus, kehvunud, kehvutud
kekkama, kekata, kekkab, kekatakse, kekake, kekkas, kekanud, kekatud
kekslema, kekselda, keksleb, kekseldakse, kekselge, keksles, kekselnud, kekseldud
kelgutama, kelgutada, kelgutab, kelgutatakse, kelgutage, kelgutas, kelgutanud, kelgutatud
kelkima, kelkida, kelgib, kelgitakse, kelkige, kelkis, kelkinud, kelgitud
kellama, kellata, kellab, kellatakse, kellake, kellas, kellanud, kellatud
kelmistuma, kelmistuda, kelmistub, kelmistutakse, kelmistuge, kelmistus, kelmistunud, kelmistutud
kemplema, kembelda, kempleb, kembeldakse, kembelge, kemples, kembelnud, kembeldud
kenastama, kenastada, kenastab, kenastatakse, kenastage, kenastas, kenastanud, kenastatud
keppima, keppida, kepib, kepitakse, keppige, keppis, keppinud, kepitud
kepsama, kepsata, kepsab, kepsatakse, kepsake, kepsas, kepsanud, kepsatud
kepsima, kepsida, kepsib, kepsitakse, kepsige, kepsis, kepsinud, kepsitud
kepslema, kepselda, kepsleb, kepseldakse, kepselge, kepsles, kepselnud, kepseldud
kepsutama, kepsutada, kepsutab, kepsutatakse, kepsutage, kepsutas, kepsutanud, kepsutatud
kergendama, kergendada, kergendab, kergendatakse, kergendage, kergendas, kergendanud, kergendatud
kergenema, kergeneda, kergeneb, kergenetakse, kergenege, kergenes, kergenenud, kergenetud
kergitama, kergitada, kergitab, kergitatakse, kergitage, kergitas, kergitanud, kergitatud
kerima, kerida, kerib, keritakse, kerige, keris, kerinud, keritud
kerjama, kerjata, kerjab, kerjatakse, kerjake, kerjas, kerjanud, kerjatud
kerkima, kerkida, kerkib, kerkitakse, kerkige, kerkis, kerkinud, kerkitud
keskendama, keskendada, keskendab, keskendatakse, keskendage, keskendas, keskendanud, keskendatud
keskenduma, keskenduda, keskendub, keskendutakse, keskenduge, keskendus, keskendunud, keskendutud
keskustlema, keskustleda, keskustleb, keskustletakse, keskustlege, keskustles, keskustlenud, keskustletud
kestendama, kestendada, kestendab, kestendatakse, kestendage, kestendas, kestendanud, kestendatud
kestma, kesta, kestab, kestetakse, kestke, kestis, kestnud, kestetud
ketendama, ketendada, ketendab, ketendatakse, ketendage, ketendas, ketendanud, ketendatud
ketistama, ketistada, ketistab, ketistatakse, ketistage, ketistas, ketistanud, ketistatud
ketitama, ketitada, ketitab, ketitatakse, ketitage, ketitas, ketitanud, ketitatud
ketrama, kedrata, ketrab, kedratakse, kedrake, ketras, kedranud, kedratud
kibelema, kibelda|kibeleda, kibeleb, kibeldakse|kibeletakse, kibelge|kibelege, kibeles, kibelnud|kibelenud, kibeldud|kibeletud
kibestuma, kibestuda, kibestub, kibestutakse, kibestuge, kibestus, kibestunud, kibestutud
kibrutama, kibrutada, kibrutab, kibrutatakse, kibrutage, kibrutas, kibrutanud, kibrutatud
kiduma, kiduda, kidub, kidutakse, kiduge, kidus, kidunud, kidutud
kihama, kihada, kihab, kihatakse, kihage, kihas, kihanud, kihatud
kiharduma, kiharduda, kihardub, kihardutakse, kiharduge, kihardus, kihardunud, kihardutud
kihelema, kihelda|kiheleda, kiheleb, kiheldakse|kiheletakse, kihelge|kihelege, kiheles, kihelnud|kihelenud, kiheldud|kiheletud
kihisema, kihiseda, kihiseb, kihisetakse, kihisege, kihises, kihisenud, kihisetud
kihistama, kihistada, kihistab, kihistatakse, kihistage, kihistas, kihistanud, kihistatud
kihistuma, kihistuda, kihistub, kihistutakse, kihistuge, kihistus, kihistunud, kihistutud
