rüüpama, rüübata, rüüpab, rüübatakse, rüübake, rüüpas, rüübanud, rüübatud
rüüstama, rüüstata, rüüstab, rüüstatakse, rüüstake, rüüstas, rüüstanud, rüüstatud
rüütama, rüütada, rüütab, rüütatakse, rüütage, rüütas, rüütanud, rüütatud
rüütuma, rüütuda, rüütub, rüütutakse, rüütuge, rüütus, rüütunud, rüütutud
rüvetama, rüvetada, rüvetab, rüvetatakse, rüvetage, rüvetas, rüvetanud, rüvetatud
saabastama, saabastada, saabastab, saabastatakse, saabastage, saabastas, saabastanud, saabastatud
saabuma, saabuda, saabub, saabutakse, saabuge, saabus, saabunud, saabutud
saagima, saagida, saeb, saetakse, saagige, saagis, saaginud, saetud
saalima, saalida, saalib, saalitakse, saalige, saalis, saalinud, saalitud
saama, saada, saab, saadakse, saage, sai, saanud, saadud
saastama, saastata, saastab, saastatakse, saastake, saastas, saastanud, saastatud
säästma, säästa, säästab, säästetakse, säästke, säästis, säästnud, säästetud
saastuma, saastuda, saastub, saastutakse, saastuge, saastus, saastunud, saastutud
saatma, saata, saadab, saadetakse, saatke, saatis, saatnud, saadetud
saavutama, saavutada, saavutab, saavutatakse, saavutage, saavutas, saavutanud, saavutatud
säbardama, säbardada, säbardab, säbardatakse, säbardage, säbardas, säbardanud, säbardatud
säbarduma, säbarduda, säbardub, säbardutakse, säbarduge, säbardus, säbardunud, säbardutud
sabisema, sabiseda, sabiseb, sabisetakse, sabisege, sabises, sabisenud, sabisetud
sabistama, sabistada, sabistab, sabistatakse, sabistage, sabistas, sabistanud, sabistatud
saboteerima, saboteerida, saboteerib, saboteeritakse, saboteerige, saboteeris, saboteerinud, saboteeritud
säbrutama, säbrutada, säbrutab, säbrutatakse, säbrutage, säbrutas, säbrutanud, säbrutatud
sadama, sadada, sajab, sajatakse, sadage, sadas, sadanud, sajatud
sädelema, sädelda|sädeleda, sädeleb, sädeldakse|sädeletakse, sädelge|sädelege, sädeles, sädelnud|sädelenud, sädeldud|sädeletud
sadenema, sadeneda, sadeneb, sadenetakse, sadenege, sadenes, sadenenud, sadenetud
sadestama, sadestada, sadestab, sadestatakse, sadestage, sadestas, sadestanud, sadestatud
sadestuma, sadestuda, sadestub, sadestutakse, sadestuge, sadestus, sadestunud, sadestutud
sädistama, sädistada, sädistab, sädistatakse, sädistage, sädistas, sädistanud, sädistatud
saduldama, saduldada, saduldab, saduldatakse, saduldage, saduldas, saduldanud, saduldatud
sagarduma, sagarduda, sagardub, sagardutakse, sagarduge, sagardus, sagardunud, sagardutud
sagendama, sagendada, sagendab, sagendatakse, sagendage, sagendas, sagendanud, sagendatud
sagenema, sageneda, sageneb, sagenetakse, sagenege, sagenes, sagenenud, sagenetud
sagima, sagida, sagib, sagitakse, sagige, sagis, saginud, sagitud
sagrima, sagrida, sagrib, sagritakse, sagrige, sagris, sagrinud, sagritud
sahisema, sahiseda, sahiseb, sahisetakse, sahisege, sahises, sahisenud, sahisetud
sahistama, sahistada, sahistab, sahistatakse, sahistage, sahistas, sahistanud, sahistatud
sahkama, sahata, sahkab, sahatakse, sahake, sahkas, sahanud, sahatud
sahkerdama, sahkerdada, sahkerdab, sahkerdatakse, sahkerdage, sahkerdas, sahkerdanud, sahkerdatud
sahmama, sahmata, sahmab, sahmatakse, sahmake, sahmas, sahmanud, sahmatud
sahmerdama, sahmerdada, sahmerdab, sahmerdatakse, sahmerdage, sahmerdas, sahmerdanud, sahmerdatud
sahmima, sahmida, sahmib, sahmitakse, sahmige, sahmis, sahminud, sahmitud
sahteldama, sahteldada, sahteldab, sahteldatakse, sahteldage, sahteldas, sahteldanud, sahteldatud
sähvama, sähvata, sähvab, sähvatakse, sähvake, sähvas, sähvanud, sähvatud
sähvatama, sähvatada, sähvatab, sähvatatakse, sähvatage, sähvatas, sähvatanud, sähvatatud
sähvima, sähvida, sähvib, sähvitakse, sähvige, sähvis, sähvinud, sähvitud
säilima, säilida, säilib, säilitakse, säilige, säilis, säilinud, säilitud
säilitama, säilitada, säilitab, säilitatakse, säilitage, säilitas, säilitanud, säilitatud
sajakordistama, sajakordistada, sajakordistab, sajakordistatakse, sajakordistage, sajakordistas, sajakordistanud, sajakordistatud
sajakordistuma, sajakordistuda, sajakordistub, sajakordistutakse, sajakordistuge, sajakordistus, sajakordistunud, sajakordistutud
sajatama, sajatada, sajatab, sajatatakse, sajatage, sajatas, sajatanud, sajatatud
sakitama, sakitada, sakitab, sakitatakse, sakitage, sakitas, sakitanud, sakitatud
sakruma, sakruda, sakrub, sakrutakse, sakruge, sakrus, sakrunud, sakrutud
saksandama, saksandada, saksandab, saksandatakse, saksandage, saksandas, saksandanud, saksandatud
saksapärastama, saksapärastada, saksapärastab, saksapärastatakse, saksapärastage, saksapärastas, saksapärastanud, saksapärastatud
saksastama, saksastada, saksastab, saksastatakse, saksastage, saksastas, saksastanud, saksastatud
saksastuma, saksastuda, saksastub, saksastutakse, saksastuge, saksastus, saksastunud, saksastutud
sakutama, sakutada, sakutab, sakutatakse, sakutage, sakutas, sakutanud, sakutatud
salakaubitsema, salakaubitseda, salakaubitseb, salakaubitsetakse, salakaubitsege, salakaubitses, salakaubitsenud, salakaubitsetud
salakuulama, salakuulata, salakuulab, salakuulatakse, salakuulake, salakuulas, salakuulanud, salakuulatud
salapärastama, salapärastada, salapärastab, salapärastatakse, salapärastage, salapärastas, salapärastanud, salapärastatud
salapäratsema, salapäratseda, salapäratseb, salapäratsetakse, salapäratsege, salapäratses, salapäratsenud, salapäratsetud
salasepitsema, salasepitseda, salasepitseb, salasepitsetakse, salasepitsege, salasepitses, salasepitsenud, salasepitsetud
salastama, salastada, salastab, salastatakse, salastage, salastas, salastanud, salastatud
salatsema, salatseda, salatseb, salatsetakse, salatsege, salatses, salatsenud, salatsetud
saldeerima, saldeerida, saldeerib, saldeeritakse, saldeerige, saldeeris, saldeerinud, saldeeritud
salenema, saleneda, saleneb, salenetakse, salenege, salenes, salenenud, salenetud
salgama, salata, salgab, salatakse, salake, salgas, salanud, salatud
sälgustama, sälgustada, sälgustab, sälgustatakse, sälgustage, sälgustas, sälgustanud, sälgustatud
sälkama, sälgata, sälkab, sälgatakse, sälgake, sälkas, sälganud, sälgatud
sälkima, sälkida, sälgib, sälgitakse, sälkige, sälkis, sälkinud, sälgitud
sallima, sallida, sallib, sallitakse, sallige, sallis, sallinud, sallitud
salmima, salmida, salmib, salmitakse, salmige, salmis, salminud, salmitud
saluteerima, saluteerida, saluteerib, saluteeritakse, saluteerige, saluteeris, saluteerinud, saluteeritud
salvama, salvata, salvab, salvatakse, salvake, salvas, salvanud, salvatud
salvestama, salvestada, salvestab, salvestatakse, salvestage, salvestas, salvestanud, salvestatud
salvestuma, salvestuda, salvestub, salvestutakse, salvestuge, salvestus, salvestunud, salvestutud
salvima, salvida, salvib, salvitakse, salvige, salvis, salvinud, salvitud
samastama, samastada, samastab, samastatakse, samastage, samastas, samastanud, samastatud
samastuma, samastuda, samastub, samastutakse, samastuge, samastus, samastunud, samastutud
samavääristama, samavääristada, samavääristab, samavääristatakse, samavääristage, samavääristas, samavääristanud, samavääristatud
sammaldama, sammaldada, sammaldab, sammaldatakse, sammaldage, sammaldas, sammaldanud, sammaldatud
sammalduma, sammalduda, sammaldub, sammaldutakse, sammalduge, sammaldus, sammaldunud, sammaldutud
sammuma, sammuda, sammub, sammutakse, sammuge, sammus, sammunud, sammutud
sandistama, sandistada, sandistab, sandistatakse, sandistage, sandistas, sandistanud, sandistatud
sandistuma, sandistuda, sandistub, sandistutakse, sandistuge, sandistus, sandistunud, sandistutud
saneerima, saneerida, saneerib, saneeritakse, saneerige, saneeris, saneerinud, saneeritud
sängitama, sängitada, sängitab, sängitatakse, sängitage, sängitas, sängitanud, sängitatud
sanktsioneerima, sanktsioneerida, sanktsioneerib, sanktsioneeritakse, sanktsioneerige, sanktsioneeris, sanktsioneerinud, sanktsioneeritud
šantažeerima, šantažeerida, šantažeerib, šantažeeritakse, šantažeerige, šantažeeris, šantažeerinud, šantažeeritud
santima, santida, sandib, sanditakse, santige, santis, santinud, sanditud
santlaagerdama, santlaagerdada, santlaagerdab, santlaagerdatakse, santlaagerdage, santlaagerdas, santlaagerdanud, santlaagerdatud
sapistama, sapistada, sapistab, sapistatakse, sapistage, sapistas, sapistanud, sapistatud
sapistuma, sapistuda, sapistub, sapistutakse, sapistuge, sapistus, sapistunud, sapistutud
säpruma, säpruda, säprub, säprutakse, säpruge, säprus, säprunud, säprutud
sapsima, sapsida, sapsib, sapsitakse, sapsige, sapsis, sapsinud, sapsitud
saputama, saputada, saputab, saputatakse, saputage, saputas, saputanud, saputatud
särama, särada, särab, säratakse, särage, säras, säranud, säratud
särisema, säriseda, säriseb, särisetakse, särisege, särises, särisenud, särisetud
säristama, säristada, säristab, säristatakse, säristage, säristas, säristanud, säristatud
säritama, säritada, säritab, säritatakse, säritage, säritas, säritanud, säritatud
sarjama, sarjata, sarjab, sarjatakse, sarjake, sarjas, sarjanud, sarjatud
sarnanema, sarnaneda, sarnaneb, sarnanetakse, sarnanege, sarnanes, sarnanenud, sarnanetud
sarnastama, sarnastada, sarnastab, sarnastatakse, sarnastage, sarnastas, sarnastanud, sarnastatud
sarnastuma, sarnastuda, sarnastub, sarnastutakse, sarnastuge, sarnastus, sarnastunud, sarnastutud
särtsama, särtsata, särtsab, särtsatakse, särtsake, särtsas, särtsanud, särtsatud
särtsatama, särtsatada, särtsatab, särtsatatakse, särtsatage, särtsatas, särtsatanud, särtsatatud
särtsuma, särtsuda, särtsub, särtsutakse, särtsuge, särtsus, särtsunud, särtsutud
sarvestuma, sarvestuda, sarvestub, sarvestutakse, sarvestuge, sarvestus, sarvestunud, sarvestutud
sasima, sasida, sasib, sasitakse, sasige, sasis, sasinud, sasitud
sasinema, sasineda, sasineb, sasinetakse, sasinege, sasines, sasinenud, sasinetud
sassuma, sassuda, sassub, sassutakse, sassuge, sassus, sassunud, sassutud
sätendama, sätendada, sätendab, sätendatakse, sätendage, sätendas, sätendanud, sätendatud
sätestama, sätestada, sätestab, sätestatakse, sätestage, sätestas, sätestanud, sätestatud
sättima, sättida, sätib, sätitakse, sättige, sättis, sättinud, sätitud
sattuma, sattuda, sattub|satub, sattutakse|satutakse, sattuge, sattus, sattunud, sattutud|satutud
satutama, satutada, satutab, satutatakse, satutage, satutas, satutanud, satutatud
säuksuma, säuksuda, säuksub, säuksutakse, säuksuge, säuksus, säuksunud, säuksutud
saunatama, saunatada, saunatab, saunatatakse, saunatage, saunatas, saunatanud, saunatatud
säutsuma, säutsuda, säutsub, säutsutakse, säutsuge, säutsus, säutsunud, säutsutud
savistuma, savistuda, savistub, savistutakse, savistuge, savistus, savistunud, savistutud
seadistama, seadistada, seadistab, seadistatakse, seadistage, seadistas, seadistanud, seadistatud
seadma, seada, seab, seatakse, seadke, seadis, seadnud, seatud
seadmestama, seadmestada, seadmestab, seadmestatakse, seadmestage, seadmestas, seadmestanud, seadmestatud
seaduslikustama, seaduslikustada, seaduslikustab, seaduslikustatakse, seaduslikustage, seaduslikustas, seaduslikustanud, seaduslikustatud
seaduspärastama, seaduspärastada, seaduspärastab, seaduspärastatakse, seaduspärastage, seaduspärastas, seaduspärastanud, seaduspärastatud
seadustama, seadustada, seadustab, seadustatakse, seadustage, seadustas, seadustanud, seadustatud
seadustuma, seadustuda, seadustub, seadustutakse, seadustuge, seadustus, seadustunud, seadustutud
sebima, sebida, sebib, sebitakse, sebige, sebis, sebinud, sebitud
sedastama, sedastada, sedastab, sedastatakse, sedastage, sedastas, sedastanud, sedastatud
sedeldama, sedeldada, sedeldab, sedeldatakse, sedeldage, sedeldas, sedeldanud, sedeldatud
seebitama, seebitada, seebitab, seebitatakse, seebitage, seebitas, seebitanud, seebitatud
seedima, seedida, seedib, seeditakse, seedige, seedis, seedinud, seeditud
seeduma, seeduda, seedub, seedutakse, seeduge, seedus, seedunud, seedutud
seemendama, seemendada, seemendab, seemendatakse, seemendage, seemendas, seemendanud, seemendatud
seenetama, seenetada, seenetab, seenetatakse, seenetage, seenetas, seenetanud, seenetatud
segama, segada, segab, segatakse, segage, segas, seganud, segatud
segmenteerima, segmenteerida, segmenteerib, segmenteeritakse, segmenteerige, segmenteeris, segmenteerinud, segmenteeritud
segmenteeruma, segmenteeruda, segmenteerub, segmenteerutakse, segmenteeruge, segmenteerus, segmenteerunud, segmenteerutud
segmentima, segmentida, segmendib, segmenditakse, segmentige, segmentis, segmentinud, segmenditud
segunema, seguneda, seguneb, segunetakse, segunege, segunes, segunenud, segunetud
segustama, segustada, segustab, segustatakse, segustage, segustas, segustanud, segustatud
sehkendama, sehkendada, sehkendab, sehkendatakse, sehkendage, sehkendas, sehkendanud, sehkendatud
sehvtitama, sehvtitada, sehvtitab, sehvtitatakse, sehvtitage, sehvtitas, sehvtitanud, sehvtitatud
šeikima, šeikida, šeigib, šeigitakse, šeikige, šeikis, šeikinud, šeigitud
seiklema, seigelda, seikleb, seigeldakse, seigelge, seikles, seigelnud, seigeldud
seilama, seilata, seilab, seilatakse, seilake, seilas, seilanud, seilatud
seirama, seirata, seirab, seiratakse, seirake, seiras, seiranud, seiratud
seisatama, seisatada, seisatab, seisatatakse, seisatage, seisatas, seisatanud, seisatatud
seiskama, seisata, seiskab, seisatakse, seisake, seiskas, seisanud, seisatud
seiskuma, seiskuda, seiskub, seiskutakse, seiskuge, seiskus, seiskunud, seiskutud
seisma, seista, seisab, seistakse, seiske, seisis, seisnud, seistud
seisnema, seisneda, seisneb, seisnetakse, seisnege, seisnes, seisnenud, seisnetud
seitsmekordistama, seitsmekordistada, seitsmekordistab, seitsmekordistatakse, seitsmekordistage, seitsmekordistas, seitsmekordistanud, seitsmekordistatud
seitsmekordistuma, seitsmekordistuda, seitsmekordistub, seitsmekordistutakse, seitsmekordistuge, seitsmekordistus, seitsmekordistunud, seitsmekordistutud
seivima, seivida, seivib, seivitakse, seivige, seivis, seivinud, seivitud
sekeldama, sekeldada, sekeldab, sekeldatakse, sekeldage, sekeldas, sekeldanud, sekeldatud
sekkuma, sekkuda, sekkub, sekkutakse, sekkuge, sekkus, sekkunud, sekkutud
seksima, seksida, seksib, seksitakse, seksige, seksis, seksinud, seksitud
sekulariseerima, sekulariseerida, sekulariseerib, sekulariseeritakse, sekulariseerige, sekulariseeris, sekulariseerinud, sekulariseeritud
sekulariseeruma, sekulariseeruda, sekulariseerub, sekulariseerutakse, sekulariseeruge, sekulariseerus, sekulariseerunud, sekulariseerutud
sekundeerima, sekundeerida, sekundeerib, sekundeeritakse, sekundeerige, sekundeeris, sekundeerinud, sekundeeritud
sekvestreerima, sekvestreerida, sekvestreerib, sekvestreeritakse, sekvestreerige, sekvestreeris, sekvestreerinud, sekvestreeritud
selekteerima, selekteerida, selekteerib, selekteeritakse, selekteerige, selekteeris, selekteerinud, selekteeritud
seletama, seletada, seletab, seletatakse, seletage, seletas, seletanud, seletatud
seletuma, seletuda, seletub, seletutakse, seletuge, seletus, seletunud, seletutud
selgendama, selgendada, selgendab, selgendatakse, selgendage, selgendas, selgendanud, selgendatud
selgenema, selgeneda, selgeneb, selgenetakse, selgenege, selgenes, selgenenud, selgenetud
selgima, selgida, selgib, selgitakse, selgige, selgis, selginud, selgitud
selginema, selgineda, selgineb, selginetakse, selginege, selgines, selginenud, selginetud
selgitama, selgitada, selgitab, selgitatakse, selgitage, selgitas, selgitanud, selgitatud
selguma, selguda, selgub, selgutakse, selguge, selgus, selgunud, selgutud
selitama, selitada, selitab, selitatakse, selitage, selitas, selitanud, selitatud
seljatama, seljatada, seljatab, seljatatakse, seljatage, seljatas, seljatanud, seljatatud
seltsima, seltsida, seltsib, seltsitakse, seltsige, seltsis, seltsinud, seltsitud
selvima, selvida, selvib, selvitakse, selvige, selvis, selvinud, selvitud
semmima, semmida, semmib, semmitakse, semmige, semmis, semminud, semmitud
semutsema, semutseda, semutseb, semutsetakse, semutsege, semutses, semutsenud, semutsetud
sensibiliseerima, sensibiliseerida, sensibiliseerib, sensibiliseeritakse, sensibiliseerige, sensibiliseeris, sensibiliseerinud, sensibiliseeritud
sensibiliseeruma, sensibiliseeruda, sensibiliseerub, sensibiliseerutakse, sensibiliseeruge, sensibiliseerus, sensibiliseerunud, sensibiliseerutud
sentimentaalitsema, sentimentaalitseda, sentimentaalitseb, sentimentaalitsetakse, sentimentaalitsege, sentimentaalitses, sentimentaalitsenud, sentimentaalitsetud
seondama, seondada, seondab, seondatakse, seondage, seondas, seondanud, seondatud
seonduma, seonduda, seondub, seondutakse, seonduge, seondus, seondunud, seondutud
seostama, seostada, seostab, seostatakse, seostage, seostas, seostanud, seostatud
seostuma, seostuda, seostub, seostutakse, seostuge, seostus, seostunud, seostutud
separeerima, separeerida, separeerib, separeeritakse, separeerige, separeeris, separeerinud, separeeritud
separeeruma, separeeruda, separeerub, separeerutakse, separeeruge, separeerus, separeerunud, separeerutud
sepistama, sepistada, sepistab, sepistatakse, sepistage, sepistas, sepistanud, sepistatud
sepitsema, sepitseda, sepitseb, sepitsetakse, sepitsege, sepitses, sepitsenud, sepitsetud
sertifitseerima, sertifitseerida, sertifitseerib, sertifitseeritakse, sertifitseerige, sertifitseeris, sertifitseerinud, sertifitseeritud
servama, servata, servab, servatakse, servake, servas, servanud, servatud
serveerima, serveerida, serveerib, serveeritakse, serveerige, serveeris, serveerinud, serveeritud
servima, servida, servib, servitakse, servige, servis, servinud, servitud
setitama, setitada, setitab, setitatakse, setitage, setitas, setitanud, setitatud
settima, settida, setib|settib, setitakse|settitakse, settige, settis, settinud, setitud|settitud
sibama, sibada, sibab, sibatakse, sibage, sibas, sibanud, sibatud
siblima, siblida, siblib, siblitakse, siblige, siblis, siblinud, siblitud
sidistama, sidistada, sidistab, sidistatakse, sidistage, sidistas, sidistanud, sidistatud
siduma, siduda, seob, seotakse, siduge, sidus, sidunud, seotud
sidurdama, sidurdada, sidurdab, sidurdatakse, sidurdage, sidurdas, sidurdanud, sidurdatud
šifreerima, šifreerida, šifreerib, šifreeritakse, šifreerige, šifreeris, šifreerinud, šifreeritud
sigatsema, sigatseda, sigatseb, sigatsetakse, sigatsege, sigatses, sigatsenud, sigatsetud
sigima, sigida, sigib, sigitakse, sigige, sigis, siginud, sigitud
siginema, sigineda, sigineb, siginetakse, siginege, sigines, siginenud, siginetud
sigitama, sigitada, sigitab, sigitatakse, sigitage, sigitas, sigitanud, sigitatud
signaalima, signaalida, signaalib, signaalitakse, signaalige, signaalis, signaalinud, signaalitud
signaliseerima, signaliseerida, signaliseerib, signaliseeritakse, signaliseerige, signaliseeris, signaliseerinud, signaliseeritud
signeerima, signeerida, signeerib, signeeritakse, signeerige, signeeris, signeerinud, signeeritud
sihisema, sihiseda, sihiseb, sihisetakse, sihisege, sihises, sihisenud, sihisetud
sihitama, sihitada, sihitab, sihitatakse, sihitage, sihitas, sihitanud, sihitatud
sihtfinantseerima, sihtfinantseerida, sihtfinantseerib, sihtfinantseeritakse, sihtfinantseerige, sihtfinantseeris, sihtfinantseerinud, sihtfinantseeritud
sihtima, sihtida, sihib, sihitakse, sihtige, sihtis, sihtinud, sihitud
sihtrahastama, sihtrahastada, sihtrahastab, sihtrahastatakse, sihtrahastage, sihtrahastas, sihtrahastanud, sihtrahastatud
siiberdama, siiberdada, siiberdab, siiberdatakse, siiberdage, siiberdas, siiberdanud, siiberdatud
siiluma, siiluda, siilub, siilutakse, siiluge, siilus, siilunud, siilutud
siilutama, siilutada, siilutab, siilutatakse, siilutage, siilutas, siilutanud, siilutatud
siirdama, siirata|siirdada, siirdab, siiratakse|siirdatakse, siirake|siirdage, siirdas, siiranud|siirdanud, siiratud|siirdatud
siirdistutama, siirdistutada, siirdistutab, siirdistutatakse, siirdistutage, siirdistutas, siirdistutanud, siirdistutatud
siirduma, siirduda, siirdub, siirdutakse, siirduge, siirdus, siirdunud, siirdutud
siirma, siirda, siirab, siirdakse, siirge, siiris, siirnud, siirdud
siksakitama, siksakitada, siksakitab, siksakitatakse, siksakitage, siksakitas, siksakitanud, siksakitatud
sikutama, sikutada, sikutab, sikutatakse, sikutage, sikutas, sikutanud, sikutatud
silbitama, silbitada, silbitab, silbitatakse, silbitage, silbitas, silbitanud, silbitatud
sildistama, sildistada, sildistab, sildistatakse, sildistage, sildistas, sildistanud, sildistatud
silditama, silditada, silditab, silditatakse, silditage, silditas, silditanud, silditatud
silduma, silduda, sildub, sildutakse, silduge, sildus, sildunud, sildutud
sileerima, sileerida, sileerib, sileeritakse, sileerige, sileeris, sileerinud, sileeritud
silendama, silendada, silendab, silendatakse, silendage, silendas, silendanud, silendatud
silenema, sileneda, sileneb, silenetakse, silenege, silenes, silenenud, silenetud
silitama, silitada, silitab, silitatakse, silitage, silitas, silitanud, silitatud
silkama, silgata, silkab, silgatakse, silgake, silkas, silganud, silgatud
silksuma, silksuda, silksub, silksutakse, silksuge, silksus, silksunud, silksutud
sillerdama, sillerdada, sillerdab, sillerdatakse, sillerdage, sillerdas, sillerdanud, sillerdatud
sillutama, sillutada, sillutab, sillutatakse, sillutage, sillutas, sillutanud, sillutatud
silmakirjatsema, silmakirjatseda, silmakirjatseb, silmakirjatsetakse, silmakirjatsege, silmakirjatses, silmakirjatsenud, silmakirjatsetud
silmama, silmata, silmab, silmatakse, silmake, silmas, silmanud, silmatud
silmitsema, silmitseda, silmitseb, silmitsetakse, silmitsege, silmitses, silmitsenud, silmitsetud
silostama, silostada, silostab, silostatakse, silostage, silostas, silostanud, silostatud
siltsuma, siltsuda, siltsub, siltsutakse, siltsuge, siltsus, siltsunud, siltsutud
siluma, siluda, silub, silutakse, siluge, silus, silunud, silutud
simplifitseerima, simplifitseerida, simplifitseerib, simplifitseeritakse, simplifitseerige, simplifitseeris, simplifitseerinud, simplifitseeritud
simuleerima, simuleerida, simuleerib, simuleeritakse, simuleerige, simuleeris, simuleerinud, simuleeritud
sinama, sinada, sinab, sinatakse, sinage, sinas, sinanud, sinatud
sinatama, sinatada, sinatab, sinatatakse, sinatage, sinatas, sinatanud, sinatatud
sinendama, sinendada, sinendab, sinendatakse, sinendage, sinendas, sinendanud, sinendatud
sinetama, sinetada, sinetab, sinetatakse, sinetage, sinetas, sinetanud, sinetatud
sinetuma, sinetuda, sinetub, sinetutakse, sinetuge, sinetus, sinetunud, sinetutud
siplema, sipelda, sipleb, sipeldakse, sipelge, siples, sipelnud, sipeldud
siputama, siputada, siputab, siputatakse, siputage, siputas, siputanud, siputatud
sirama, sirada, sirab, siratakse, sirage, siras, siranud, siratud
sirendama, sirendada, sirendab, sirendatakse, sirendage, sirendas, sirendanud, sirendatud
sirgeldama, sirgeldada, sirgeldab, sirgeldatakse, sirgeldage, sirgeldas, sirgeldanud, sirgeldatud
sirgendama, sirgendada, sirgendab, sirgendatakse, sirgendage, sirgendas, sirgendanud, sirgendatud
sirgenema, sirgeneda, sirgeneb, sirgenetakse, sirgenege, sirgenes, sirgenenud, sirgenetud
sirgestama, sirgestada, sirgestab, sirgestatakse, sirgestage, sirgestas, sirgestanud, sirgestatud
sirgestuma, sirgestuda, sirgestub, sirgestutakse, sirgestuge, sirgestus, sirgestunud, sirgestutud
sirguma, sirguda, sirgub, sirgutakse, sirguge, sirgus, sirgunud, sirgutud
sirisema, siriseda, siriseb, sirisetakse, sirisege, sirises, sirisenud, sirisetud
siristama, siristada, siristab, siristatakse, siristage, siristas, siristanud, siristatud
sirtsatama, sirtsatada, sirtsatab, sirtsatatakse, sirtsatage, sirtsatas, sirtsatanud, sirtsatatud
sirtsuma, sirtsuda, sirtsub, sirtsutakse, sirtsuge, sirtsus, sirtsunud, sirtsutud
sirutama, sirutada, sirutab, sirutatakse, sirutage, sirutas, sirutanud, sirutatud
sirutuma, sirutuda, sirutub, sirututakse, sirutuge, sirutus, sirutunud, sirututud
sirvima, sirvida, sirvib, sirvitakse, sirvige, sirvis, sirvinud, sirvitud
sisaldama, sisaldada, sisaldab, sisaldatakse, sisaldage, sisaldas, sisaldanud, sisaldatud
sisalduma, sisalduda, sisaldub, sisaldutakse, sisalduge, sisaldus, sisaldunud, sisaldutud
sisekujundama, sisekujundada, sisekujundab, sisekujundatakse, sisekujundage, sisekujundas, sisekujundanud, sisekujundatud
sisendama, sisendada, sisendab, sisendatakse, sisendage, sisendas, sisendanud, sisendatud
sisenema, siseneda, siseneb, sisenetakse, sisenege, sisenes, sisenenud, sisenetud
sisestama, sisestada, sisestab, sisestatakse, sisestage, sisestas, sisestanud, sisestatud
sisisema, sisiseda, sisiseb, sisisetakse, sisisege, sisises, sisisenud, sisisetud
sisistama, sisistada, sisistab, sisistatakse, sisistage, sisistas, sisistanud, sisistatud
sisustama, sisustada, sisustab, sisustatakse, sisustage, sisustas, sisustanud, sisustatud
sitsima, sitsida, sitsib, sitsitakse, sitsige, sitsis, sitsinud, sitsitud
sittuma, sittuda, situb, situtakse, sittuge, sittus, sittunud, situtud
siuglema, siuelda, siugleb, siueldakse, siuelge, siugles, siuelnud, siueldud
siuksuma, siuksuda, siuksub, siuksutakse, siuksuge, siuksus, siuksunud, siuksutud
siunama, siunata, siunab, siunatakse, siunake, siunas, siunanud, siunatud
siutsuma, siutsuda, siutsub, siutsutakse, siutsuge, siutsus, siutsunud, siutsutud
skaleerima, skaleerida, skaleerib, skaleeritakse, skaleerige, skaleeris, skaleerinud, skaleeritud
skalpeerima, skalpeerida, skalpeerib, skalpeeritakse, skalpeerige, skalpeeris, skalpeerinud, skalpeeritud
skandaalitsema, skandaalitseda, skandaalitseb, skandaalitsetakse, skandaalitsege, skandaalitses, skandaalitsenud, skandaalitsetud
skandeerima, skandeerida, skandeerib, skandeeritakse, skandeerige, skandeeris, skandeerinud, skandeeritud
