aadeldama, aadeldada, aadeldab, aadeldatakse, aadeldage, aadeldas, aadeldanud, aadeldatud
ääristama, ääristada, ääristab, ääristatakse, ääristage, ääristas, ääristanud, ääristatud
aasama, aasata, aasab, aasatakse, aasake, aasas, aasanud, aasatud
aatlema, aadelda, aatleb, aadeldakse, aadelge, aatles, aadelnud, aadeldud
abielluma, abielluda, abiellub, abiellutakse, abielluge, abiellus, abiellunud, abiellutud
abistama, abistada, abistab, abistatakse, abistage, abistas, abistanud, abistatud
ablastuma, ablastuda, ablastub, ablastutakse, ablastuge, ablastus, ablastunud, ablastutud
aboneerima, aboneerida, aboneerib, aboneeritakse, aboneerige, aboneeris, aboneerinud, aboneeritud
aborteerima, aborteerida, aborteerib, aborteeritakse, aborteerige, aborteeris, aborteerinud, aborteeritud
abortima, abortida, abordib, aborditakse, abortige, abortis, abortinud, aborditud
absolutiseerima, absolutiseerida, absolutiseerib, absolutiseeritakse, absolutiseerige, absolutiseeris, absolutiseerinud, absolutiseeritud
absoluudistama, absoluudistada, absoluudistab, absoluudistatakse, absoluudistage, absoluudistas, absoluudistanud, absoluudistatud
absoluutima, absoluutida, absoluudib, absoluuditakse, absoluutige, absoluutis, absoluutinud, absoluuditud
absorbeerima, absorbeerida, absorbeerib, absorbeeritakse, absorbeerige, absorbeeris, absorbeerinud, absorbeeritud
absorbeeruma, absorbeeruda, absorbeerub, absorbeerutakse, absorbeeruge, absorbeerus, absorbeerunud, absorbeerutud
abstraheerima, abstraheerida, abstraheerib, abstraheeritakse, abstraheerige, abstraheeris, abstraheerinud, abstraheeritud
abstraheeruma, abstraheeruda, abstraheerub, abstraheerutakse, abstraheeruge, abstraheerus, abstraheerunud, abstraheerutud
adapteerima, adapteerida, adapteerib, adapteeritakse, adapteerige, adapteeris, adapteerinud, adapteeritud
adapteeruma, adapteeruda, adapteerub, adapteerutakse, adapteeruge, adapteerus, adapteerunud, adapteerutud
adjektiveeruma, adjektiveeruda, adjektiveerub, adjektiveerutakse, adjektiveeruge, adjektiveerus, adjektiveerunud, adjektiveerutud
administreerima, administreerida, administreerib, administreeritakse, administreerige, administreeris, administreerinud, administreeritud
adopteerima, adopteerida, adopteerib, adopteeritakse, adopteerige, adopteeris, adopteerinud, adopteeritud
adresseerima, adresseerida, adresseerib, adresseeritakse, adresseerige, adresseeris, adresseerinud, adresseeritud
adsorbeerima, adsorbeerida, adsorbeerib, adsorbeeritakse, adsorbeerige, adsorbeeris, adsorbeerinud, adsorbeeritud
adsorbeeruma, adsorbeeruda, adsorbeerub, adsorbeerutakse, adsorbeeruge, adsorbeerus, adsorbeerunud, adsorbeerutud
aduma, aduda, adub, adutakse, aduge, adus, adunud, adutud
adverbialiseeruma, adverbialiseeruda, adverbialiseerub, adverbialiseerutakse, adverbialiseeruge, adverbialiseerus, adverbialiseerunud, adverbialiseerutud
adverbistuma, adverbistuda, adverbistub, adverbistutakse, adverbistuge, adverbistus, adverbistunud, adverbistutud
aeglustama, aeglustada, aeglustab, aeglustatakse, aeglustage, aeglustas, aeglustanud, aeglustatud
aeglustuma, aeglustuda, aeglustub, aeglustutakse, aeglustuge, aeglustus, aeglustunud, aeglustutud
aeguma, aeguda, aegub, aegutakse, aeguge, aegus, aegunud, aegutud
aelema, aeleda, aeleb, aeletakse, aelege, aeles, aelenud, aeletud
aerosoolitama, aerosoolitada, aerosoolitab, aerosoolitatakse, aerosoolitage, aerosoolitas, aerosoolitanud, aerosoolitatud
aerutama, aerutada, aerutab, aerutatakse, aerutage, aerutas, aerutanud, aerutatud
äestama, äestada, äestab, äestatakse, äestage, äestas, äestanud, äestatud
aetama, aetada, aetab, aetatakse, aetage, aetas, aetanud, aetatud
aevastama, aevastada, aevastab, aevastatakse, aevastage, aevastas, aevastanud, aevastatud
afekteerima, afekteerida, afekteerib, afekteeritakse, afekteerige, afekteeris, afekteerinud, afekteeritud
afilieerima, afilieerida, afilieerib, afilieeritakse, afilieerige, afilieeris, afilieerinud, afilieeritud
afineerima, afineerida, afineerib, afineeritakse, afineerige, afineeris, afineerinud, afineeritud
afirmeerima, afirmeerida, afirmeerib, afirmeeritakse, afirmeerige, afirmeeris, afirmeerinud, afirmeeritud
ägama, ägada, ägab, ägatakse, ägage, ägas, äganud, ägatud
agatama, agatada, agatab, agatatakse, agatage, agatas, agatanud, agatatud
ägenema, ägeneda, ägeneb, ägenetakse, ägenege, ägenes, ägenenud, ägenetud
ägestama, ägestada, ägestab, ägestatakse, ägestage, ägestas, ägestanud, ägestatud
ägestuma, ägestuda, ägestub, ägestutakse, ägestuge, ägestus, ägestunud, ägestutud
ägetsema, ägetseda, ägetseb, ägetsetakse, ägetsege, ägetses, ägetsenud, ägetsetud
ägisema, ägiseda, ägiseb, ägisetakse, ägisege, ägises, ägisenud, ägisetud
agiteerima, agiteerida, agiteerib, agiteeritakse, agiteerige, agiteeris, agiteerinud, agiteeritud
aglutineerima, aglutineerida, aglutineerib, aglutineeritakse, aglutineerige, aglutineeris, aglutineerinud, aglutineeritud
aglutineeruma, aglutineeruda, aglutineerub, aglutineerutakse, aglutineeruge, aglutineerus, aglutineerunud, aglutineerutud
agrariseeruma, agrariseeruda, agrariseerub, agrariseerutakse, agrariseeruge, agrariseerus, agrariseerunud, agrariseerutud
agregeerima, agregeerida, agregeerib, agregeeritakse, agregeerige, agregeeris, agregeerinud, agregeeritud
ahaatama, ahaatada, ahaatab, ahaatatakse, ahaatage, ahaatas, ahaatanud, ahaatatud
ahahhitama, ahahhitada, ahahhitab, ahahhitatakse, ahahhitage, ahahhitas, ahahhitanud, ahahhitatud
ahastama, ahastada, ahastab, ahastatakse, ahastage, ahastas, ahastanud, ahastatud
aheldama, aheldada, aheldab, aheldatakse, aheldage, aheldas, aheldanud, aheldatud
ahelduma, ahelduda, aheldub, aheldutakse, ahelduge, aheldus, aheldunud, aheldutud
ahendama, ahendada, ahendab, ahendatakse, ahendage, ahendas, ahendanud, ahendatud
ahenema, aheneda, aheneb, ahenetakse, ahenege, ahenes, ahenenud, ahenetud
ahhetama, ahhetada, ahhetab, ahhetatakse, ahhetage, ahhetas, ahhetanud, ahhetatud
ahistama, ahistada, ahistab, ahistatakse, ahistage, ahistas, ahistanud, ahistatud
ahkima, ahkida, ahib, ahitakse, ahkige, ahkis, ahkinud, ahitud
ähkima, ähkida, ähib, ähitakse, ähkige, ähkis, ähkinud, ähitud
ahmama, ahmata, ahmab, ahmatakse, ahmake, ahmas, ahmanud, ahmatud
ähmastama, ähmastada, ähmastab, ähmastatakse, ähmastage, ähmastas, ähmastanud, ähmastatud
ähmastuma, ähmastuda, ähmastub, ähmastutakse, ähmastuge, ähmastus, ähmastunud, ähmastutud
ähmenema, ähmeneda, ähmeneb, ähmenetakse, ähmenege, ähmenes, ähmenenud, ähmenetud
ahmima, ahmida, ahmib, ahmitakse, ahmige, ahmis, ahminud, ahmitud
ahmitsema, ahmitseda, ahmitseb, ahmitsetakse, ahmitsege, ahmitses, ahmitsenud, ahmitsetud
ähmitsema, ähmitseda, ähmitseb, ähmitsetakse, ähmitsege, ähmitses, ähmitsenud, ähmitsetud
ähmuma, ähmuda, ähmub, ähmutakse, ähmuge, ähmus, ähmunud, ähmutud
ahnitsema, ahnitseda, ahnitseb, ahnitsetakse, ahnitsege, ahnitses, ahnitsenud, ahnitsetud
ähvardama, ähvardada, ähvardab, ähvardatakse, ähvardage, ähvardas, ähvardanud, ähvardatud
ahvatlema, ahvatleda, ahvatleb, ahvatletakse, ahvatlege, ahvatles, ahvatlenud, ahvatletud
ahvima, ahvida, ahvib, ahvitakse, ahvige, ahvis, ahvinud, ahvitud
aietama, aietada, aietab, aietatakse, aietage, aietas, aietanud, aietatud
äigama, äiata, äigab, äiatakse, äiake, äigas, äianud, äiatud
aimama, aimata, aimab, aimatakse, aimake, aimas, aimanud, aimatud
aimuma, aimuda, aimub, aimutakse, aimuge, aimus, aimunud, aimutud
ainestama, ainestada, ainestab, ainestatakse, ainestage, ainestas, ainestanud, ainestatud
ainuvalitsema, ainuvalitseda, ainuvalitseb, ainuvalitsetakse, ainuvalitsege, ainuvalitses, ainuvalitsenud, ainuvalitsetud
aistima, aistida, aistib, aistitakse, aistige, aistis, aistinud, aistitud
aitama, aidata, aitab, aidatakse, aidake, aitas, aidanud, aidatud
äiutama, äiutada, äiutab, äiutatakse, äiutage, äiutas, äiutanud, äiutatud
ajakohastama, ajakohastada, ajakohastab, ajakohastatakse, ajakohastage, ajakohastas, ajakohastanud, ajakohastatud
ajama, ajada, ajab, aetakse, ajage, ajas, ajanud, aetud
ajastama, ajastada, ajastab, ajastatakse, ajastage, ajastas, ajastanud, ajastatud
ajatama, ajatada, ajatab, ajatatakse, ajatage, ajatas, ajatanud, ajatatud
ajendama, ajendada, ajendab, ajendatakse, ajendage, ajendas, ajendanud, ajendatud
ajuma, ajuda, ajub, ajutakse, ajuge, ajus, ajunud, ajutud
akendama, akendada, akendab, akendatakse, akendage, akendas, akendanud, akendatud
aklimatiseerima, aklimatiseerida, aklimatiseerib, aklimatiseeritakse, aklimatiseerige, aklimatiseeris, aklimatiseerinud, aklimatiseeritud
aklimatsieeruma, aklimatsieeruda, aklimatsieerub, aklimatsieerutakse, aklimatsieeruge, aklimatsieerus, aklimatsieerunud, aklimatsieerutud
akommodeeruma, akommodeeruda, akommodeerub, akommodeerutakse, akommodeeruge, akommodeerus, akommodeerunud, akommodeerutud
akompaneerima, akompaneerida, akompaneerib, akompaneeritakse, akompaneerige, akompaneeris, akompaneerinud, akompaneeritud
akordeerima, akordeerida, akordeerib, akordeeritakse, akordeerige, akordeeris, akordeerinud, akordeeritud
akrediteerima, akrediteerida, akrediteerib, akrediteeritakse, akrediteerige, akrediteeris, akrediteerinud, akrediteeritud
aktiivistama, aktiivistada, aktiivistab, aktiivistatakse, aktiivistage, aktiivistas, aktiivistanud, aktiivistatud
aktiivistuma, aktiivistuda, aktiivistub, aktiivistutakse, aktiivistuge, aktiivistus, aktiivistunud, aktiivistutud
aktiveerima, aktiveerida, aktiveerib, aktiveeritakse, aktiveerige, aktiveeris, aktiveerinud, aktiveeritud
aktiveeruma, aktiveeruda, aktiveerub, aktiveerutakse, aktiveeruge, aktiveerus, aktiveerunud, aktiveerutud
aktiviseerima, aktiviseerida, aktiviseerib, aktiviseeritakse, aktiviseerige, aktiviseeris, aktiviseerinud, aktiviseeritud
aktiviseeruma, aktiviseeruda, aktiviseerub, aktiviseerutakse, aktiviseeruge, aktiviseerus, aktiviseerunud, aktiviseerutud
aktsentueerima, aktsentueerida, aktsentueerib, aktsentueeritakse, aktsentueerige, aktsentueeris, aktsentueerinud, aktsentueeritud
aktsepteerima, aktsepteerida, aktsepteerib, aktsepteeritakse, aktsepteerige, aktsepteeris, aktsepteerinud, aktsepteeritud
aktualiseeruma, aktualiseeruda, aktualiseerub, aktualiseerutakse, aktualiseeruge, aktualiseerus, aktualiseerunud, aktualiseerutud
akumuleerima, akumuleerida, akumuleerib, akumuleeritakse, akumuleerige, akumuleeris, akumuleerinud, akumuleeritud
akumuleeruma, akumuleeruda, akumuleerub, akumuleerutakse, akumuleeruge, akumuleerus, akumuleerunud, akumuleerutud
akvarellima, akvarellida, akvarellib, akvarellitakse, akvarellige, akvarellis, akvarellinud, akvarellitud
alafinantseerima, alafinantseerida, alafinantseerib, alafinantseeritakse, alafinantseerige, alafinantseeris, alafinantseerinud, alafinantseeritud
alahindama, alahinnata, alahindab, alahinnatakse, alahinnake, alahindas, alahinnanud, alahinnatud
alandama, alandada, alandab, alandatakse, alandage, alandas, alandanud, alandatud
alanduma, alanduda, alandub, alandutakse, alanduge, alandus, alandunud, alandutud
alanema, alaneda, alaneb, alanetakse, alanege, alanes, alanenud, alanetud
alarahastama, alarahastada, alarahastab, alarahastatakse, alarahastage, alarahastas, alarahastanud, alarahastatud
alarmeerima, alarmeerida, alarmeerib, alarmeeritakse, alarmeerige, alarmeeris, alarmeerinud, alarmeeritud
alarmima, alarmida, alarmib, alarmitakse, alarmige, alarmis, alarminud, alarmitud
alastama, alastada, alastab, alastatakse, alastage, alastas, alastanud, alastatud
alavääristama, alavääristada, alavääristab, alavääristatakse, alavääristage, alavääristas, alavääristanud, alavääristatud
alaväärtustama, alaväärtustada, alaväärtustab, alaväärtustatakse, alaväärtustage, alaväärtustas, alaväärtustanud, alaväärtustatud
aletama, aletada, aletab, aletatakse, aletage, aletas, aletanud, aletatud
algama, alata, algab, alatakse, alake, algas, alanud, alatud
algatama, algatada, algatab, algatatakse, algatage, algatas, algatanud, algatatud
alglaadima, alglaadida, alglaadib, alglaaditakse, alglaadige, alglaadis, alglaadinud, alglaaditud
algoritmima, algoritmida, algoritmib, algoritmitakse, algoritmige, algoritmis, algoritminud, algoritmitud
algväärtustama, algväärtustada, algväärtustab, algväärtustatakse, algväärtustage, algväärtustas, algväärtustanud, algväärtustatud
alistama, alistada, alistab, alistatakse, alistage, alistas, alistanud, alistatud
alistuma, alistuda, alistub, alistutakse, alistuge, alistus, alistunud, alistutud
allegoriseerima, allegoriseerida, allegoriseerib, allegoriseeritakse, allegoriseerige, allegoriseeris, allegoriseerinud, allegoriseeritud
allieeruma, allieeruda, allieerub, allieerutakse, allieeruge, allieerus, allieerunud, allieerutud
allitereeruma, allitereeruda, allitereerub, allitereerutakse, allitereeruge, allitereerus, allitereerunud, allitereerutud
allkirjastama, allkirjastada, allkirjastab, allkirjastatakse, allkirjastage, allkirjastas, allkirjastanud, allkirjastatud
allrentima, allrentida, allrendib, allrenditakse, allrentige, allrentis, allrentinud, allrenditud
alluma, alluda, allub, allutakse, alluge, allus, allunud, allutud
allutama, allutada, allutab, allutatakse, allutage, allutas, allutanud, allutatud
allüürima, allüürida, allüürib, allüüritakse, allüürige, allüüris, allüürinud, allüüritud
altereerima, altereerida, altereerib, altereeritakse, altereerige, altereeris, altereerinud, altereeritud
alterneerima, alterneerida, alterneerib, alterneeritakse, alterneerige, alterneeris, alterneerinud, alterneeritud
alustama, alustada, alustab, alustatakse, alustage, alustas, alustanud, alustatud
ameerikastama, ameerikastada, ameerikastab, ameerikastatakse, ameerikastage, ameerikastas, ameerikastanud, ameerikastatud
ameerikastuma, ameerikastuda, ameerikastub, ameerikastutakse, ameerikastuge, ameerikastus, ameerikastunud, ameerikastutud
amelema, amelda|ameleda, ameleb, ameldakse|ameletakse, amelge|amelege, ameles, amelnud|amelenud, ameldud|ameletud
amerikaniseerima, amerikaniseerida, amerikaniseerib, amerikaniseeritakse, amerikaniseerige, amerikaniseeris, amerikaniseerinud, amerikaniseeritud
amerikaniseeruma, amerikaniseeruda, amerikaniseerub, amerikaniseerutakse, amerikaniseeruge, amerikaniseerus, amerikaniseerunud, amerikaniseerutud
ammendama, ammendada, ammendab, ammendatakse, ammendage, ammendas, ammendanud, ammendatud
ammenduma, ammenduda, ammendub, ammendutakse, ammenduge, ammendus, ammendunud, ammendutud
ammuma, ammuda, ammub, ammutakse, ammuge, ammus, ammunud, ammutud
ammutama, ammutada, ammutab, ammutatakse, ammutage, ammutas, ammutanud, ammutatud
amnesteerima, amnesteerida, amnesteerib, amnesteeritakse, amnesteerige, amnesteeris, amnesteerinud, amnesteeritud
amortiseerima, amortiseerida, amortiseerib, amortiseeritakse, amortiseerige, amortiseeris, amortiseerinud, amortiseeritud
amortiseeruma, amortiseeruda, amortiseerub, amortiseerutakse, amortiseeruge, amortiseerus, amortiseerunud, amortiseerutud
amplifitseerima, amplifitseerida, amplifitseerib, amplifitseeritakse, amplifitseerige, amplifitseeris, amplifitseerinud, amplifitseeritud
ampsama, ampsata, ampsab, ampsatakse, ampsake, ampsas, ampsanud, ampsatud
ampullima, ampullida, ampullib, ampullitakse, ampullige, ampullis, ampullinud, ampullitud
amputeerima, amputeerida, amputeerib, amputeeritakse, amputeerige, amputeeris, amputeerinud, amputeeritud
amüseerima, amüseerida, amüseerib, amüseeritakse, amüseerige, amüseeris, amüseerinud, amüseeritud
analüüsima, analüüsida, analüüsib, analüüsitakse, analüüsige, analüüsis, analüüsinud, analüüsitud
anastama, anastada, anastab, anastatakse, anastage, anastas, anastanud, anastatud
andestama, andestada, andestab, andestatakse, andestage, andestas, andestanud, andestatud
andma, anda, annab, antakse, andke, andis, andnud, antud
anduma, anduda, andub, andutakse, anduge, andus, andunud, andutud
anesteseerima, anesteseerida, anesteseerib, anesteseeritakse, anesteseerige, anesteseeris, anesteseerinud, anesteseeritud
angažeerima, angažeerida, angažeerib, angažeeritakse, angažeerige, angažeeris, angažeerinud, angažeeritud
ängistama, ängistada, ängistab, ängistatakse, ängistage, ängistas, ängistanud, ängistatud
ängistuma, ängistuda, ängistub, ängistutakse, ängistuge, ängistus, ängistunud, ängistutud
animeerima, animeerida, animeerib, animeeritakse, animeerige, animeeris, animeerinud, animeeritud
ankeetima, ankeetida, ankeedib, ankeeditakse, ankeetige, ankeetis, ankeetinud, ankeeditud
ankurdama, ankurdada, ankurdab, ankurdatakse, ankurdage, ankurdas, ankurdanud, ankurdatud
annekteerima, annekteerida, annekteerib, annekteeritakse, annekteerige, annekteeris, annekteerinud, annekteeritud
annetama, annetada, annetab, annetatakse, annetage, annetas, annetanud, annetatud
annoteerima, annoteerida, annoteerib, annoteeritakse, annoteerige, annoteeris, annoteerinud, annoteeritud
annulleerima, annulleerida, annulleerib, annulleeritakse, annulleerige, annulleeris, annulleerinud, annulleeritud
annustama, annustada, annustab, annustatakse, annustage, annustas, annustanud, annustatud
antikiseerima, antikiseerida, antikiseerib, antikiseeritakse, antikiseerige, antikiseeris, antikiseerinud, antikiseeritud
antitsipeerima, antitsipeerida, antitsipeerib, antitsipeeritakse, antitsipeerige, antitsipeeris, antitsipeerinud, antitsipeeritud
anuma, anuda, anub, anutakse, anuge, anus, anunud, anutud
äparduma, äparduda, äpardub, äpardutakse, äparduge, äpardus, äpardunud, äpardutud
apelleerima, apelleerida, apelleerib, apelleeritakse, apelleerige, apelleeris, apelleerinud, apelleeritud
aplitseerima, aplitseerida, aplitseerib, aplitseeritakse, aplitseerige, aplitseeris, aplitseerinud, aplitseeritud
aplodeerima, aplodeerida, aplodeerib, aplodeeritakse, aplodeerige, aplodeeris, aplodeerinud, aplodeeritud
apostrofeerima, apostrofeerida, apostrofeerib, apostrofeeritakse, apostrofeerige, apostrofeeris, apostrofeerinud, apostrofeeritud
aprobeerima, aprobeerida, aprobeerib, aprobeeritakse, aprobeerige, aprobeeris, aprobeerinud, aprobeeritud
aproksimeerima, aproksimeerida, aproksimeerib, aproksimeeritakse, aproksimeerige, aproksimeeris, aproksimeerinud, aproksimeeritud
arabiseeruma, arabiseeruda, arabiseerub, arabiseerutakse, arabiseeruge, arabiseerus, arabiseerunud, arabiseerutud
ärandama, ärandada, ärandab, ärandatakse, ärandage, ärandas, ärandanud, ärandatud
arastama, arastada, arastab, arastatakse, arastage, arastas, arastanud, arastatud
ärastama, ärastada, ärastab, ärastatakse, ärastage, ärastas, ärastanud, ärastatud
arastuma, arastuda, arastub, arastutakse, arastuge, arastus, arastunud, arastutud
äratama, äratada, äratab, äratatakse, äratage, äratas, äratanud, äratatud
arbitreerima, arbitreerida, arbitreerib, arbitreeritakse, arbitreerige, arbitreeris, arbitreerinud, arbitreeritud
arendama, arendada, arendab, arendatakse, arendage, arendas, arendanud, arendatud
arenema, areneda, areneb, arenetakse, arenege, arenes, arenenud, arenetud
arestima, arestida, arestib, arestitakse, arestige, arestis, arestinud, arestitud
aretama, aretada, aretab, aretatakse, aretage, aretas, aretanud, aretatud
argipäevastama, argipäevastada, argipäevastab, argipäevastatakse, argipäevastage, argipäevastas, argipäevastanud, argipäevastatud
argipäevastuma, argipäevastuda, argipäevastub, argipäevastutakse, argipäevastuge, argipäevastus, argipäevastunud, argipäevastutud
argistama, argistada, argistab, argistatakse, argistage, argistas, argistanud, argistatud
argistuma, argistuda, argistub, argistutakse, argistuge, argistus, argistunud, argistutud
ärgitama, ärgitada, ärgitab, ärgitatakse, ärgitage, ärgitas, ärgitanud, ärgitatud
arglema, arelda, argleb, areldakse, arelge, argles, arelnud, areldud
argumenteerima, argumenteerida, argumenteerib, argumenteeritakse, argumenteerige, argumenteeris, argumenteerinud, argumenteeritud
arhaiseerima, arhaiseerida, arhaiseerib, arhaiseeritakse, arhaiseerige, arhaiseeris, arhaiseerinud, arhaiseeritud
arhiivima, arhiivida, arhiivib, arhiivitakse, arhiivige, arhiivis, arhiivinud, arhiivitud
arhiveerima, arhiveerida, arhiveerib, arhiveeritakse, arhiveerige, arhiveeris, arhiveerinud, arhiveeritud
ärima, ärida, ärib, äritakse, ärige, äris, ärinud, äritud
aristokratiseerima, aristokratiseerida, aristokratiseerib, aristokratiseeritakse, aristokratiseerige, aristokratiseeris, aristokratiseerinud, aristokratiseeritud
äritsema, äritseda, äritseb, äritsetakse, äritsege, äritses, äritsenud, äritsetud
ärkama, ärgata, ärkab, ärgatakse, ärgake, ärkas, ärganud, ärgatud
armastama, armastada, armastab, armastatakse, armastage, armastas, armastanud, armastatud
armatsema, armatseda, armatseb, armatsetakse, armatsege, armatses, armatsenud, armatsetud
armistama, armistada, armistab, armistatakse, armistage, armistas, armistanud, armistatud
armistuma, armistuda, armistub, armistutakse, armistuge, armistus, armistunud, armistutud
armukadestama, armukadestada, armukadestab, armukadestatakse, armukadestage, armukadestas, armukadestanud, armukadestatud
armukadetsema, armukadetseda, armukadetseb, armukadetsetakse, armukadetsege, armukadetses, armukadetsenud, armukadetsetud
armuma, armuda, armub, armutakse, armuge, armus, armunud, armutud
aromatiseeruma, aromatiseeruda, aromatiseerub, aromatiseerutakse, aromatiseeruge, aromatiseerus, aromatiseerunud, aromatiseerutud
aromatsieerima, aromatsieerida, aromatsieerib, aromatsieeritakse, aromatsieerige, aromatsieeris, aromatsieerinud, aromatsieeritud
ärplema, ärbelda, ärpleb, ärbeldakse, ärbelge, ärples, ärbelnud, ärbeldud
arranžeerima, arranžeerida, arranžeerib, arranžeeritakse, arranžeerige, arranžeeris, arranžeerinud, arranžeeritud
arreteerima, arreteerida, arreteerib, arreteeritakse, arreteerige, arreteeris, arreteerinud, arreteeritud
ärritama, ärritada, ärritab, ärritatakse, ärritage, ärritas, ärritanud, ärritatud
ärrituma, ärrituda, ärritub, ärritutakse, ärrituge, ärritus, ärritunud, ärritutud
arstima, arstida, arstib, arstitakse, arstige, arstis, arstinud, arstitud
artikuleerima, artikuleerida, artikuleerib, artikuleeritakse, artikuleerige, artikuleeris, artikuleerinud, artikuleeritud
arutama, arutada, arutab, arutatakse, arutage, arutas, arutanud, arutatud
arutlema, arutleda, arutleb, arutletakse, arutlege, arutles, arutlenud, arutletud
arvama, arvata, arvab, arvatakse, arvake, arvas, arvanud, arvatud
arveldama, arveldada, arveldab, arveldatakse, arveldage, arveldas, arveldanud, arveldatud
arvestama, arvestada, arvestab, arvestatakse, arvestage, arvestas, arvestanud, arvestatud
arvustama, arvustada, arvustab, arvustatakse, arvustage, arvustas, arvustanud, arvustatud
arvutama, arvutada, arvutab, arvutatakse, arvutage, arvutas, arvutanud, arvutatud
äsama, äsada, äsab, äsatakse, äsage, äsas, äsanud, äsatud
asendama, asendada, asendab, asendatakse, asendage, asendas, asendanud, asendatud
asenduma, asenduda, asendub, asendutakse, asenduge, asendus, asendunud, asendutud
asenema, aseneda, aseneb, asenetakse, asenege, asenes, asenenud, asenetud
asetama, asetada, asetab, asetatakse, asetage, asetas, asetanud, asetatud
asetsema, asetseda, asetseb, asetsetakse, asetsege, asetses, asetsenud, asetsetud
asetuma, asetuda, asetub, asetutakse, asetuge, asetus, asetunud, asetutud
asfalteerima, asfalteerida, asfalteerib, asfalteeritakse, asfalteerige, asfalteeris, asfalteerinud, asfalteeritud
asjatama, asjatada, asjatab, asjatatakse, asjatage, asjatas, asjatanud, asjatatud
askeldama, askeldada, askeldab, askeldatakse, askeldage, askeldas, askeldanud, askeldatud
aspireerima, aspireerida, aspireerib, aspireeritakse, aspireerige, aspireeris, aspireerinud, aspireeritud
assigneerima, assigneerida, assigneerib, assigneeritakse, assigneerige, assigneeris, assigneerinud, assigneeritud
assimileerima, assimileerida, assimileerib, assimileeritakse, assimileerige, assimileeris, assimileerinud, assimileeritud
assimileeruma, assimileeruda, assimileerub, assimileerutakse, assimileeruge, assimileerus, assimileerunud, assimileerutud
assisteerima, assisteerida, assisteerib, assisteeritakse, assisteerige, assisteeris, assisteerinud, assisteeritud
ässitama, ässitada, ässitab, ässitatakse, ässitage, ässitas, ässitanud, ässitatud
assoneeruma, assoneeruda, assoneerub, assoneerutakse, assoneeruge, assoneerus, assoneerunud, assoneerutud
assotsieerima, assotsieerida, assotsieerib, assotsieeritakse, assotsieerige, assotsieeris, assotsieerinud, assotsieeritud
assotsieeruma, assotsieeruda, assotsieerub, assotsieerutakse, assotsieeruge, assotsieerus, assotsieerunud, assotsieerutud
astendama, astendada, astendab, astendatakse, astendage, astendas, astendanud, astendatud
astuma, astuda, astub, astutakse, astuge, astus, astunud, astutud
asuma, asuda, asub, asutakse, asuge, asus, asunud, asutud
asundama, asundada, asundab, asundatakse, asundage, asundas, asundanud, asundatud
asunema, asuneda, asuneb, asunetakse, asunege, asunes, asunenud, asunetud
asustama, asustada, asustab, asustatakse, asustage, asustas, asustanud, asustatud
asutama, asutada, asutab, asutatakse, asutage, asutas, asutanud, asutatud
atakeerima, atakeerida, atakeerib, atakeeritakse, atakeerige, atakeeris, atakeerinud, atakeeritud
atašeerima, atašeerida, atašeerib, atašeeritakse, atašeerige, atašeeris, atašeerinud, atašeeritud
atesteerima, atesteerida, atesteerib, atesteeritakse, atesteerige, atesteeris, atesteerinud, atesteeritud
ätistuma, ätistuda, ätistub, ätistutakse, ätistuge, ätistus, ätistunud, ätistutud
atomiseerima, atomiseerida, atomiseerib, atomiseeritakse, atomiseerige, atomiseeris, atomiseerinud, atomiseeritud
atraheerima, atraheerida, atraheerib, atraheeritakse, atraheerige, atraheeris, atraheerinud, atraheeritud
atrofeeruma, atrofeeruda, atrofeerub, atrofeerutakse, atrofeeruge, atrofeerus, atrofeerunud, atrofeerutud
